,number,value,datetime_start,datetime_complete,duration,params_batch_size,params_buffer_size,params_gamma,params_learning_rate,params_learning_starts,params_log_std_init,params_net_arch,params_tau,params_train_freq,state
0,0,77.274083,2023-05-18 16:50:20.177972,2023-05-18 16:51:18.678173,0 days 00:00:58.500201,256,10000,0.95,0.002592628666813629,0,0.5689354399723889,medium,0.08,32,COMPLETE
1,1,152.54747400000002,2023-05-18 16:50:20.179082,2023-05-18 16:50:22.825696,0 days 00:00:02.646614,2048,1000000,0.9999,0.3753143028722636,1000,-1.691033571090843,small,0.02,512,COMPLETE
2,2,34.783894,2023-05-18 16:50:20.195198,2023-05-18 16:50:22.058503,0 days 00:00:01.863305,32,10000,0.9,0.08192304995376866,20000,-0.88828706081688,big,0.02,32,COMPLETE
3,3,97.7055622,2023-05-18 16:50:20.203440,2023-05-18 16:50:22.411090,0 days 00:00:02.207650,256,1000000,0.99,0.0063301972808268315,20000,0.915990916742011,small,0.05,256,COMPLETE
4,4,63.11240780000001,2023-05-18 16:50:22.061433,2023-05-18 16:51:01.879236,0 days 00:00:39.817803,32,100000,0.9,0.00031682935620997934,0,0.4438995920439597,medium,0.08,16,COMPLETE
5,5,18.102538199999998,2023-05-18 16:50:22.412429,2023-05-18 16:50:23.114571,0 days 00:00:00.702142,16,1000000,0.99,1.946916325651977e-05,1000,-1.3874758904111886,small,0.01,16,COMPLETE
6,6,40.480986400000006,2023-05-18 16:50:22.836538,2023-05-18 16:50:51.128910,0 days 00:00:28.292372,64,100000,0.999,0.1165869474268685,0,0.9068975009458038,small,0.01,64,COMPLETE
7,7,11.567569,2023-05-18 16:50:23.118299,2023-05-18 16:50:23.879021,0 days 00:00:00.760722,1024,1000000,0.9999,9.863860506640864e-05,10000,0.4793142987402419,medium,0.08,32,COMPLETE
8,8,,2023-05-18 16:50:23.881121,2023-05-18 16:50:38.168592,0 days 00:00:14.287471,64,10000,0.9999,0.21407238928620087,0,-1.926849401729613,small,0.001,32,PRUNED
9,9,12.392883999999999,2023-05-18 16:50:38.170956,2023-05-18 16:50:38.806388,0 days 00:00:00.635432,32,1000000,0.9999,0.003953151450896363,20000,-3.204021065717096,small,0.08,16,COMPLETE
10,10,22.9480736,2023-05-18 16:50:38.807952,2023-05-18 16:50:39.705158,0 days 00:00:00.897206,256,10000,0.98,9.35154816986494e-05,10000,-1.5215809941071665,small,0.02,128,COMPLETE
11,11,214.9583228,2023-05-18 16:50:39.708148,2023-05-18 16:50:41.345206,0 days 00:00:01.637058,16,1000000,0.9,0.008786411964673937,1000,0.20580477074293668,small,0.005,4,COMPLETE
12,12,24.324498400000003,2023-05-18 16:50:41.346398,2023-05-18 16:50:42.162585,0 days 00:00:00.816187,2048,1000000,0.9999,0.003298834208764469,10000,-2.147643800821998,small,0.01,512,COMPLETE
13,13,126.94133439999999,2023-05-18 16:50:42.163617,2023-05-18 16:50:44.068559,0 days 00:00:01.904942,2048,1000000,0.9,6.148577608633421e-05,1000,0.8512285466435531,big,0.005,4,COMPLETE
14,14,15.813718,2023-05-18 16:50:44.069618,2023-05-18 16:50:44.648856,0 days 00:00:00.579238,2048,1000000,0.9,0.10462008550408669,1000,-1.7227106797333671,small,0.02,32,PRUNED
15,15,11.3351744,2023-05-18 16:50:44.650750,2023-05-18 16:50:45.477421,0 days 00:00:00.826671,16,10000,0.9999,0.007788687676234555,1000,0.32208354014192264,small,0.005,4,PRUNED
16,16,16.399527799999998,2023-05-18 16:50:45.481866,2023-05-18 16:50:46.801023,0 days 00:00:01.319157,16,1000000,0.9,0.7023824000704589,1000,-0.3519615734460614,small,0.02,4,PRUNED
17,17,15.788843199999999,2023-05-18 16:50:46.802512,2023-05-18 16:50:47.449483,0 days 00:00:00.646971,64,1000000,0.995,0.2905999165412593,1000,-1.9467933808069073,small,0.02,512,PRUNED
18,18,20.8719316,2023-05-18 16:50:47.450754,2023-05-18 16:50:48.391482,0 days 00:00:00.940728,16,1000000,0.999,0.0083999702945684,1000,0.7501582164252649,small,0.001,4,PRUNED
19,19,15.331868199999999,2023-05-18 16:50:48.394422,2023-05-18 16:50:49.113692,0 days 00:00:00.719270,128,1000000,0.9999,0.09941300693701038,1000,-3.0314625193843487,small,0.02,4,PRUNED
20,20,16.9754576,2023-05-18 16:50:49.117761,2023-05-18 16:50:49.907689,0 days 00:00:00.789928,64,1000000,0.9,0.00042095591093956237,1000,0.42838304228806356,small,0.08,4,PRUNED
21,21,66.886691,2023-05-18 16:50:49.910463,2023-05-18 16:51:20.056346,0 days 00:00:30.145883,16,1000000,0.9,0.031137191499273256,0,0.9681573946788533,small,0.005,16,COMPLETE
22,22,30.1508716,2023-05-18 16:50:51.129856,2023-05-18 16:50:52.362995,0 days 00:00:01.233139,1024,1000000,0.9999,0.22415612955562028,1000,-1.1932242499078924,small,0.05,512,PRUNED
23,23,40.5941062,2023-05-18 16:50:52.364460,2023-05-18 16:50:53.736244,0 days 00:00:01.371784,2048,1000000,0.9999,0.5333358959005059,1000,-0.7470910812889137,medium,0.02,4,COMPLETE
24,24,23.440400599999997,2023-05-18 16:50:53.737538,2023-05-18 16:50:54.695953,0 days 00:00:00.958415,2048,1000000,0.9,9.433752099946609e-05,1000,-0.49873094463630163,big,0.05,4,PRUNED
25,25,98.596322,2023-05-18 16:50:54.697143,2023-05-18 16:52:06.244342,0 days 00:01:11.547199,128,1000000,0.9,2.5204402075902745e-05,0,0.29884507053153786,big,0.005,4,COMPLETE
26,26,86.9741874,2023-05-18 16:51:01.880552,2023-05-18 16:51:03.302082,0 days 00:00:01.421530,1024,1000000,0.95,4.3294714873105146e-05,1000,0.11382596965039593,big,0.005,4,COMPLETE
27,27,31.8109128,2023-05-18 16:51:03.303559,2023-05-18 16:51:04.735519,0 days 00:00:01.431960,2048,1000000,0.9,4.626239718863021e-05,20000,0.21779930580178097,big,0.005,256,PRUNED
28,28,71.5233474,2023-05-18 16:51:04.736306,2023-05-18 16:51:06.220475,0 days 00:00:01.484169,16,100000,0.9999,0.13574083067784953,1000,-1.2155317401308878,small,0.02,512,COMPLETE
29,29,19.528973200000003,2023-05-18 16:51:06.222418,2023-05-18 16:51:07.071891,0 days 00:00:00.849473,128,1000000,0.9,0.00040036200108933216,1000,0.3271429164135785,big,0.005,4,PRUNED
30,30,5.584631,2023-05-18 16:51:07.073002,2023-05-18 16:51:08.732034,0 days 00:00:01.659032,2048,1000000,0.9999,0.05871072090945578,0,-2.1296998181236226,small,0.02,512,PRUNED
31,31,57.6419806,2023-05-18 16:51:08.733573,2023-05-18 16:51:10.541454,0 days 00:00:01.807881,2048,1000000,0.9999,4.7509034550598583e-05,1000,0.6931514543932602,big,0.005,4,COMPLETE
32,32,19.8447246,2023-05-18 16:51:10.542593,2023-05-18 16:51:11.562621,0 days 00:00:01.020028,2048,1000000,0.9999,0.2555444508810875,1000,-1.7460772731176175,small,0.01,512,PRUNED
33,33,215.09306120000002,2023-05-18 16:51:11.566772,2023-05-18 16:51:14.332687,0 days 00:00:02.765915,2048,1000000,0.9,0.000604414114183289,1000,0.8811308119743656,big,0.01,16,COMPLETE
34,34,12.268643800000001,2023-05-18 16:51:14.334538,2023-05-18 16:51:15.111789,0 days 00:00:00.777251,2048,1000000,0.9,0.00035139620865772204,1000,0.7378439873785199,medium,0.01,512,PRUNED
35,35,164.5196782,2023-05-18 16:51:15.112909,2023-05-18 16:51:17.264443,0 days 00:00:02.151534,32,1000000,0.999,0.0042623384994361115,1000,0.1507100261037445,big,0.01,16,COMPLETE
36,36,16.4800288,2023-05-18 16:51:17.265852,2023-05-18 16:51:18.192633,0 days 00:00:00.926781,32,1000000,0.999,0.007495568040976841,1000,0.5088400443716663,big,0.01,32,PRUNED
37,37,35.3750534,2023-05-18 16:51:18.193924,2023-05-18 16:51:19.489881,0 days 00:00:01.295957,32,1000000,0.98,0.0006054986235652638,1000,0.0614248011616364,big,0.01,16,PRUNED
38,38,25.0050354,2023-05-18 16:51:18.679459,2023-05-18 16:51:20.093215,0 days 00:00:01.413756,32,1000000,0.9,0.01413086840037678,1000,0.20001307888700445,big,0.08,16,PRUNED
39,39,60.4893238,2023-05-18 16:51:19.490972,2023-05-18 16:51:21.704936,0 days 00:00:02.213964,16,1000000,0.9,0.021038918924791514,1000,-0.8781592362992494,medium,0.005,4,PRUNED
40,40,15.3306062,2023-05-18 16:51:20.058205,2023-05-18 16:51:21.238695,0 days 00:00:01.180490,2048,100000,0.9,0.0008875248006080599,1000,0.3261413571152024,big,0.01,16,PRUNED
41,41,29.478657200000004,2023-05-18 16:51:20.094870,2023-05-18 16:51:21.399410,0 days 00:00:01.304540,16,1000000,0.9,0.0023299013036147806,1000,-0.37959060795898325,small,0.005,4,PRUNED
42,42,12.468887200000001,2023-05-18 16:51:21.239688,2023-05-18 16:51:22.700747,0 days 00:00:01.461059,512,1000000,0.9,0.005737151148289238,20000,-0.2101006360702966,small,0.005,4,PRUNED
43,43,21.056406,2023-05-18 16:51:21.400400,2023-05-18 16:51:23.696333,0 days 00:00:02.295933,64,1000000,0.999,0.0011749732181604447,1000,-0.24457539461576672,big,0.005,16,PRUNED
44,44,20.4328184,2023-05-18 16:51:21.711427,2023-05-18 16:51:23.111661,0 days 00:00:01.400234,256,1000000,0.9999,0.8527969659722406,1000,-1.5369119160793905,small,0.02,64,PRUNED
45,45,104.5632748,2023-05-18 16:51:22.702675,2023-05-18 16:51:25.825581,0 days 00:00:03.122906,128,1000000,0.9,0.00019642136885926904,1000,0.9314187548162273,small,0.01,16,COMPLETE
46,46,35.35827400000001,2023-05-18 16:51:23.112814,2023-05-18 16:51:25.302679,0 days 00:00:02.189865,2048,1000000,0.98,0.0017359963269091797,1000,0.8924187621721837,big,0.001,4,PRUNED
47,47,53.18844419999999,2023-05-18 16:51:23.697281,2023-05-18 16:51:27.382486,0 days 00:00:03.685205,32,1000000,0.999,0.12682081908135534,10000,-0.5435239995859917,big,0.01,16,PRUNED
48,48,20.6788848,2023-05-18 16:51:25.309572,2023-05-18 16:51:26.727405,0 days 00:00:01.417833,512,1000000,0.999,0.016306701246657326,1000,0.7538976780227583,big,0.01,16,PRUNED
49,49,53.3472584,2023-05-18 16:51:25.826966,2023-05-18 16:54:20.528790,0 days 00:02:54.701824,2048,1000000,0.9999,0.0006659158201745716,0,-0.26514770072710225,big,0.01,16,PRUNED
50,50,14.186917400000002,2023-05-18 16:51:26.729429,2023-05-18 16:51:28.094842,0 days 00:00:01.365413,512,1000000,0.9,5.012138072896217e-05,1000,0.1620670574872638,big,0.01,16,PRUNED
51,51,18.939454199999997,2023-05-18 16:51:27.383500,2023-05-18 16:51:28.679474,0 days 00:00:01.295974,2048,1000000,0.9,0.00010134752491332692,1000,0.5230487008544882,big,0.005,1,PRUNED
52,52,129.5089952,2023-05-18 16:51:28.097870,2023-05-18 16:51:30.209886,0 days 00:00:02.112016,2048,1000000,0.9,0.000736380642787468,10000,-0.6707877311403726,big,0.01,32,COMPLETE
53,53,29.7390264,2023-05-18 16:51:28.680690,2023-05-18 16:51:30.450242,0 days 00:00:01.769552,2048,1000000,0.9,0.022947351320599316,1000,0.20561523948571336,big,0.01,8,PRUNED
54,54,152.1166422,2023-05-18 16:51:30.211193,2023-05-18 16:51:34.671668,0 days 00:00:04.460475,32,10000,0.9,1.1083256894323162e-05,1000,0.16042981927676192,big,0.005,4,COMPLETE
55,55,25.369396599999998,2023-05-18 16:51:30.455027,2023-05-18 16:51:31.812478,0 days 00:00:01.357451,2048,1000000,0.98,0.00025890812008670465,10000,-0.7582931281452006,big,0.01,32,PRUNED
56,56,29.602473200000002,2023-05-18 16:51:31.813397,2023-05-18 16:51:33.336006,0 days 00:00:01.522609,512,1000000,0.9,0.0010914132202548752,10000,0.2011674034885964,big,0.01,32,PRUNED
57,57,13.3419668,2023-05-18 16:51:33.338355,2023-05-18 16:51:34.114867,0 days 00:00:00.776512,32,1000000,0.999,0.0029629499410799556,1000,0.3255463820348393,small,0.05,16,PRUNED
58,58,261.1866892,2023-05-18 16:51:34.118036,2023-05-18 16:51:38.424883,0 days 00:00:04.306847,2048,100000,0.9,3.908930487854969e-05,1000,-0.11037432424180504,big,0.005,4,COMPLETE
59,59,25.597115600000002,2023-05-18 16:51:34.677874,2023-05-18 16:51:36.055202,0 days 00:00:01.377328,32,10000,0.995,1.099953054401268e-05,1000,0.0303778104644237,big,0.005,8,PRUNED
60,60,20.643826400000002,2023-05-18 16:51:36.062520,2023-05-18 16:51:36.786096,0 days 00:00:00.723576,32,10000,0.9,1.105141924369549e-05,1000,0.12001294364982976,big,0.08,16,PRUNED
61,61,167.36218739999998,2023-05-18 16:51:36.787460,2023-05-18 16:51:39.057503,0 days 00:00:02.270043,32,10000,0.9,0.00010519565934481354,1000,-0.7196183593012417,big,0.005,256,COMPLETE
62,62,17.9096698,2023-05-18 16:51:38.427898,2023-05-18 16:51:39.235844,0 days 00:00:00.807946,256,100000,0.9,1.555037293307099e-05,1000,-0.22366452884457177,big,0.005,64,PRUNED
63,63,17.823865599999998,2023-05-18 16:51:39.063101,2023-05-18 16:51:40.078692,0 days 00:00:01.015591,32,10000,0.9,0.00014543220218285425,1000,-1.349058807223162,small,0.005,256,PRUNED
64,64,40.538813999999995,2023-05-18 16:51:39.236889,2023-05-18 16:51:41.070324,0 days 00:00:01.833435,32,10000,0.9,3.268703286704906e-05,1000,-1.654533315090764,big,0.001,4,PRUNED
65,65,133.2213668,2023-05-18 16:51:40.079502,2023-05-18 16:51:42.898835,0 days 00:00:02.819333,256,10000,0.9,4.0383796538909114e-05,1000,-0.3235963339905749,big,0.005,256,COMPLETE
66,66,22.265176199999996,2023-05-18 16:51:41.071550,2023-05-18 16:51:42.402474,0 days 00:00:01.330924,128,10000,0.9,0.0001330668571251351,1000,-0.5811282401094601,big,0.005,128,PRUNED
67,67,268.72515080000005,2023-05-18 16:51:42.406140,2023-05-18 16:51:46.702019,0 days 00:00:04.295879,32,10000,0.9,1.4916415744829004e-05,1000,-0.8008147258676769,big,0.005,4,COMPLETE
68,68,8.8611452,2023-05-18 16:51:42.900680,2023-05-18 16:51:43.573956,0 days 00:00:00.673276,2048,1000000,0.999,0.15191140173534987,1000,-0.8440732193259932,small,0.02,512,PRUNED
69,69,74.1681878,2023-05-18 16:51:43.575159,2023-05-18 16:51:45.746304,0 days 00:00:02.171145,2048,100000,0.9,4.831124493218932e-05,10000,0.40919702742712816,big,0.005,4,PRUNED
70,70,73.595841,2023-05-18 16:51:45.752245,2023-05-18 16:51:48.175933,0 days 00:00:02.423688,32,10000,0.9999,0.002103774309219891,1000,-1.0912150812670411,big,0.005,256,PRUNED
71,71,23.7169368,2023-05-18 16:51:46.703571,2023-05-18 16:51:48.292037,0 days 00:00:01.588466,32,10000,0.95,1.4636169811227893e-05,1000,-0.9720377430990378,medium,0.005,4,PRUNED
72,72,27.2508822,2023-05-18 16:51:48.186456,2023-05-18 16:51:49.874109,0 days 00:00:01.687653,32,100000,0.999,0.00022909210106345922,1000,-0.25482987350765823,big,0.01,16,PRUNED
73,73,42.061675,2023-05-18 16:51:48.293822,2023-05-18 16:51:50.195983,0 days 00:00:01.902161,32,1000000,0.9,0.0002847734472342408,1000,-0.6700936281428851,big,0.005,256,PRUNED
74,74,52.147531400000005,2023-05-18 16:51:49.876781,2023-05-18 16:52:44.481423,0 days 00:00:54.604642,32,10000,0.999,1.5294327261032313e-05,0,0.10962352834390654,big,0.005,4,PRUNED
75,75,31.396248200000002,2023-05-18 16:51:50.202057,2023-05-18 16:51:50.790489,0 days 00:00:00.588432,32,10000,0.9,1.420197507224072e-05,1000,-0.6407553233620578,big,0.005,4,PRUNED
76,76,51.7454604,2023-05-18 16:51:50.791570,2023-05-18 16:51:52.305185,0 days 00:00:01.513615,32,100000,0.99,1.4937083171392787e-05,1000,0.3297637291743848,big,0.005,4,PRUNED
77,77,21.3422586,2023-05-18 16:51:52.306373,2023-05-18 16:51:53.100069,0 days 00:00:00.793696,16,100000,0.9,2.204663559544979e-05,1000,-0.7053563674682739,big,0.005,4,PRUNED
78,78,45.88524460000001,2023-05-18 16:51:53.103444,2023-05-18 16:51:54.194825,0 days 00:00:01.091381,64,10000,0.9,9.155585457398602e-05,1000,0.5895967759195874,big,0.02,4,PRUNED
79,79,32.7306454,2023-05-18 16:51:54.198155,2023-05-18 16:51:55.327216,0 days 00:00:01.129061,2048,1000000,0.9,0.0007236519499856685,1000,0.5175446022442542,big,0.01,16,PRUNED
80,80,17.0057636,2023-05-18 16:51:55.328953,2023-05-18 16:51:56.215305,0 days 00:00:00.886352,32,10000,0.9,7.958980592896556e-05,20000,0.970927072551242,big,0.005,4,PRUNED
81,81,22.3562668,2023-05-18 16:51:56.216478,2023-05-18 16:51:56.870997,0 days 00:00:00.654519,32,10000,0.9,7.367441968352156e-05,20000,-1.0478122863421349,big,0.005,256,PRUNED
82,82,29.653091,2023-05-18 16:51:56.872101,2023-05-18 16:51:57.791481,0 days 00:00:00.919380,512,10000,0.98,2.2283939191032013e-05,1000,-0.20720681199992075,big,0.005,4,PRUNED
83,83,79.787141,2023-05-18 16:51:57.792612,2023-05-18 16:51:59.377130,0 days 00:00:01.584518,2048,10000,0.9999,0.21747674803685896,1000,-1.6286639232287838,medium,0.02,512,PRUNED
84,84,27.510480800000003,2023-05-18 16:51:59.378220,2023-05-18 16:52:00.346564,0 days 00:00:00.968344,256,10000,0.999,0.0001009997049803385,1000,-0.5536411761450349,big,0.005,256,PRUNED
85,85,39.2993424,2023-05-18 16:52:00.348111,2023-05-18 16:52:01.140425,0 days 00:00:00.792314,2048,100000,0.9,8.254854717218503e-05,1000,-2.141463411794904,big,0.005,32,PRUNED
86,86,18.1410916,2023-05-18 16:52:01.141482,2023-05-18 16:52:02.012805,0 days 00:00:00.871323,2048,100000,0.995,1.8700769233137658e-05,1000,0.2652394226633414,big,0.005,4,PRUNED
87,87,27.574981799999996,2023-05-18 16:52:02.013850,2023-05-18 16:52:02.773585,0 days 00:00:00.759735,256,10000,0.9,0.00012146993960486092,1000,-0.7312271882400292,medium,0.005,256,PRUNED
88,88,44.912974399999996,2023-05-18 16:52:02.776747,2023-05-18 16:52:03.704281,0 days 00:00:00.927534,32,1000000,0.999,0.013458937893558637,1000,0.39599397013237775,medium,0.01,16,PRUNED
89,89,16.8636128,2023-05-18 16:52:03.708155,2023-05-18 16:52:04.908606,0 days 00:00:01.200451,256,10000,0.9,3.513364203126918e-05,1000,-0.12303707059161498,big,0.005,256,PRUNED
90,90,29.0186942,2023-05-18 16:52:04.909713,2023-05-18 16:52:06.980094,0 days 00:00:02.070381,16,10000,0.9,0.00016653206883169,1000,0.274514523084164,big,0.005,32,PRUNED
91,91,21.7485406,2023-05-18 16:52:06.246181,2023-05-18 16:52:08.033686,0 days 00:00:01.787505,16,1000000,0.99,0.059322484009230625,1000,0.24691394995856072,small,0.005,1,PRUNED
92,92,12.718087399999998,2023-05-18 16:52:06.981813,2023-05-18 16:52:07.780468,0 days 00:00:00.798655,2048,100000,0.9,1.2881100485342468e-05,1000,-0.8960155798199109,big,0.001,4,PRUNED
93,93,46.494083200000006,2023-05-18 16:52:07.781667,2023-05-18 16:52:09.550074,0 days 00:00:01.768407,2048,1000000,0.9,0.006504104914527855,20000,0.8114670464034935,big,0.05,16,PRUNED
94,94,25.6464406,2023-05-18 16:52:08.034773,2023-05-18 16:52:09.789767,0 days 00:00:01.754994,32,1000000,0.95,0.008704313934902572,20000,0.2952225823674718,big,0.01,16,PRUNED
95,95,45.006243,2023-05-18 16:52:09.551524,2023-05-18 16:52:11.187734,0 days 00:00:01.636210,2048,1000000,0.9,0.007094650853797098,10000,-2.123954038628344,big,0.001,32,PRUNED
96,96,77.41217220000001,2023-05-18 16:52:09.790940,2023-05-18 16:52:11.698721,0 days 00:00:01.907781,32,10000,0.99,0.0002566670244578053,1000,-0.0736403379467917,big,0.01,256,PRUNED
97,97,14.159222599999998,2023-05-18 16:52:11.190689,2023-05-18 16:52:12.314406,0 days 00:00:01.123717,32,10000,0.9,0.00013580970428700242,1000,-1.8562135792034082,big,0.005,64,PRUNED
98,98,21.5364424,2023-05-18 16:52:11.701077,2023-05-18 16:52:13.647432,0 days 00:00:01.946355,16,1000000,0.999,0.00010812781652790279,1000,0.344593378504741,big,0.01,16,PRUNED
99,99,20.5589118,2023-05-18 16:52:12.315195,2023-05-18 16:52:13.106773,0 days 00:00:00.791578,64,1000000,0.9,0.027003351019733952,1000,0.7986125569097274,small,0.005,128,PRUNED
100,100,18.7045746,2023-05-18 16:52:13.108639,2023-05-18 16:52:14.503313,0 days 00:00:01.394674,2048,1000000,0.9999,0.35898890881047024,1000,-1.093397051928432,small,0.02,128,PRUNED
101,101,40.86427260000001,2023-05-18 16:52:13.649071,2023-05-18 16:52:15.701330,0 days 00:00:02.052259,2048,10000,0.9,0.00026486179233826794,1000,-0.7690678648987129,big,0.005,512,PRUNED
102,102,184.579992,2023-05-18 16:52:14.504260,2023-05-18 16:52:17.542083,0 days 00:00:03.037823,16,1000000,0.9,0.03428850973909528,1000,-0.017460833945406318,small,0.08,32,COMPLETE
103,103,30.926707600000004,2023-05-18 16:52:15.702979,2023-05-18 16:52:16.905736,0 days 00:00:01.202757,2048,1000000,0.9999,0.4973080591618646,1000,-2.216891455085416,small,0.02,512,PRUNED
104,104,57.6281288,2023-05-18 16:52:16.907113,2023-05-18 16:52:18.530124,0 days 00:00:01.623011,2048,1000000,0.9,8.23294756161903e-05,1000,0.7788087216269568,big,0.005,4,PRUNED
105,105,127.43840100000003,2023-05-18 16:52:17.544579,2023-05-18 16:52:20.319541,0 days 00:00:02.774962,2048,1000000,0.9,0.000190978379848064,10000,-1.2386170710856304,big,0.01,256,COMPLETE
106,106,10.814842200000001,2023-05-18 16:52:18.531274,2023-05-18 16:52:19.249563,0 days 00:00:00.718289,16,1000000,0.9,0.026170171665006507,1000,-1.4473371196184959,small,0.08,256,PRUNED
107,107,33.229438,2023-05-18 16:52:19.250942,2023-05-18 16:52:20.381986,0 days 00:00:01.131044,32,10000,0.999,0.008054571777767484,1000,0.46812555288615193,big,0.01,16,PRUNED
108,108,15.5390728,2023-05-18 16:52:20.321028,2023-05-18 16:52:21.309136,0 days 00:00:00.988108,16,1000000,0.95,0.09021103461141416,1000,0.7245248304399737,small,0.005,4,PRUNED
109,109,28.381258600000002,2023-05-18 16:52:20.383315,2023-05-18 16:52:22.249461,0 days 00:00:01.866146,16,1000000,0.95,0.08976370602687951,1000,-0.8210447955552909,small,0.08,32,PRUNED
110,110,15.7042392,2023-05-18 16:52:21.310455,2023-05-18 16:52:22.099217,0 days 00:00:00.788762,32,10000,0.99,1.5776075925481993e-05,1000,-0.7162286351242882,big,0.005,128,PRUNED
111,111,17.833613399999997,2023-05-18 16:52:22.102877,2023-05-18 16:52:23.231918,0 days 00:00:01.129041,16,1000000,0.995,0.04119474595765391,1000,0.0892899720580467,small,0.08,32,PRUNED
112,112,27.313290000000002,2023-05-18 16:52:22.254655,2023-05-18 16:52:23.320828,0 days 00:00:01.066173,16,1000000,0.9,0.01872924798735712,1000,-0.782678038337275,small,0.08,32,PRUNED
113,113,17.1632404,2023-05-18 16:52:23.233138,2023-05-18 16:52:24.249668,0 days 00:00:01.016530,2048,1000000,0.9,0.00023889401191828309,1000,-1.3997604477188852,big,0.01,32,PRUNED
114,114,40.101169399999996,2023-05-18 16:52:23.323389,2023-05-18 16:52:24.871767,0 days 00:00:01.548378,2048,1000000,0.9,0.0017046221339093444,10000,-0.5627290042197447,big,0.02,32,PRUNED
115,115,29.783160799999997,2023-05-18 16:52:24.252003,2023-05-18 16:52:25.432243,0 days 00:00:01.180240,2048,1000000,0.9,0.004622478936617731,10000,-1.7368313454837383,big,0.01,256,PRUNED
116,116,63.1827904,2023-05-18 16:52:24.874252,2023-05-18 16:52:27.559152,0 days 00:00:02.684900,2048,100000,0.9,0.00022244884988669063,1000,-0.3208714408137713,big,0.005,4,PRUNED
117,117,109.3413864,2023-05-18 16:52:25.434515,2023-05-18 16:52:27.056415,0 days 00:00:01.621900,128,10000,0.9,0.00012020006251132731,10000,-1.4305735767455332,big,0.01,256,COMPLETE
118,118,30.617128400000002,2023-05-18 16:52:27.058755,2023-05-18 16:52:28.363168,0 days 00:00:01.304413,32,1000000,0.999,0.0019390839608992617,1000,0.4361534601891897,big,0.001,16,PRUNED
