,number,value,datetime_start,datetime_complete,duration,params_batch_size,params_buffer_size,params_gamma,params_learning_rate,params_learning_starts,params_log_std_init,params_net_arch,params_tau,params_train_freq,state
481,481,38.270511799999994,2023-05-18 16:39:47.347746,2023-05-18 16:39:49.474013,0 days 00:00:02.126267,2048,1000000,0.98,0.00464750928740643,0,0.42313548630365405,small,0.08,512,PRUNED
482,482,39.297774200000006,2023-05-18 16:39:49.475340,2023-05-18 16:41:12.985642,0 days 00:01:23.510302,1024,1000000,0.9,0.015357678536223177,0,-0.4374250613069132,big,0.005,1,PRUNED
483,483,60.3014676,2023-05-18 16:40:12.180223,2023-05-18 16:41:18.259856,0 days 00:01:06.079633,1024,1000000,0.95,0.0002734600500931486,0,-3.7206648370316353,big,0.01,128,PRUNED
484,484,69.59303519999999,2023-05-18 16:40:22.898101,2023-05-18 16:41:01.189436,0 days 00:00:38.291335,2048,1000000,0.98,0.002614847639113308,0,-0.05976967955820589,small,0.001,16,PRUNED
485,485,10.9404594,2023-05-18 16:41:01.191938,2023-05-18 16:41:01.874558,0 days 00:00:00.682620,128,1000000,0.9,0.002384252125679679,20000,0.9768663777201745,big,0.08,1,PRUNED
486,486,111.81677080000001,2023-05-18 16:41:01.879172,2023-05-18 16:41:29.778998,0 days 00:00:27.899826,64,1000000,0.95,0.0011316910184259186,0,0.2529107982508183,big,0.05,16,PRUNED
487,487,35.282104600000004,2023-05-18 16:41:12.986916,2023-05-18 16:41:49.307437,0 days 00:00:36.320521,128,1000000,0.9,1.4269146413738262e-05,0,-0.830599582855408,big,0.08,16,PRUNED
488,488,176.06880759999999,2023-05-18 16:41:16.714227,2023-05-18 16:41:54.429131,0 days 00:00:37.714904,128,1000000,0.999,0.01102473822846792,0,-3.2263806920109532,big,0.08,1,COMPLETE
489,489,26.6664428,2023-05-18 16:41:18.261156,2023-05-18 16:41:47.075995,0 days 00:00:28.814839,64,1000000,0.9,3.068998389328854e-05,0,-0.7271425675644512,big,0.08,32,PRUNED
490,490,28.0065404,2023-05-18 16:41:29.781035,2023-05-18 16:41:30.624060,0 days 00:00:00.843025,64,100000,0.9999,0.25111911772926365,1000,-2.7307135424749847,small,0.02,64,PRUNED
491,491,125.44284480000002,2023-05-18 16:41:30.625380,2023-05-18 16:41:33.137373,0 days 00:00:02.511993,2048,1000000,0.9,0.0032896718581108017,10000,0.6367110924259919,big,0.08,16,PRUNED
492,492,83.268777,2023-05-18 16:41:33.139534,2023-05-18 16:42:43.782089,0 days 00:01:10.642555,1024,1000000,0.999,0.005279694871690475,0,-2.685215919472467,big,0.08,1,PRUNED
493,493,36.0392334,2023-05-18 16:41:47.079512,2023-05-18 16:41:47.872048,0 days 00:00:00.792536,1024,1000000,0.999,0.18251027011113133,1000,-3.3622902168313686,small,0.005,32,PRUNED
494,494,90.8871728,2023-05-18 16:41:47.873555,2023-05-18 16:42:14.912545,0 days 00:00:27.038990,64,10000,0.95,0.00021469022353485276,0,-0.039631107035277946,big,0.08,1,PRUNED
495,495,30.8540414,2023-05-18 16:41:49.309073,2023-05-18 16:41:50.082698,0 days 00:00:00.773625,512,1000000,0.9999,0.005562062074219726,1000,-2.6427811653956708,small,0.02,64,PRUNED
496,496,63.7752964,2023-05-18 16:41:50.084618,2023-05-18 16:42:10.527721,0 days 00:00:20.443103,16,10000,0.95,0.005253432216385838,0,-2.2880936403027423,big,0.08,64,PRUNED
497,497,6.5740494,2023-05-18 16:41:54.430445,2023-05-18 16:43:11.104151,0 days 00:01:16.673706,2048,1000000,0.98,0.00470954785608967,0,-0.5538593546301365,big,0.08,16,PRUNED
498,498,42.3983384,2023-05-18 16:42:10.529395,2023-05-18 16:42:50.104388,0 days 00:00:39.574993,512,1000000,0.95,0.005607998197634968,0,-3.3398408094215375,big,0.001,32,PRUNED
499,499,72.87087740000001,2023-05-18 16:42:14.914024,2023-05-18 16:42:15.597012,0 days 00:00:00.682988,64,1000000,0.9999,0.10280325372481451,1000,-3.7134170729558806,small,0.02,4,PRUNED
