,number,value,datetime_start,datetime_complete,duration,params_batch_size,params_buffer_size,params_gamma,params_learning_rate,params_learning_starts,params_log_std_init,params_net_arch,params_tau,params_train_freq,state
479,479,195.0022868,2023-05-18 18:43:59.689451,2023-05-18 18:44:00.712608,0 days 00:00:01.023157,2048,100000,0.99,1.1198640537396632e-05,1000,-1.2851575352456326,big,0.05,4,COMPLETE
480,480,97.7744638,2023-05-18 18:44:00.713718,2023-05-18 18:44:01.334710,0 days 00:00:00.620992,2048,100000,0.99,1.4610829018442033e-05,1000,-0.6818028043827589,big,0.05,4,PRUNED
481,481,42.233897,2023-05-18 18:44:01.335527,2023-05-18 18:45:13.726591,0 days 00:01:12.391064,1024,100000,0.9,2.207245219809869e-05,0,-0.838384520710706,big,0.005,128,PRUNED
482,482,17.3757448,2023-05-18 18:44:31.473777,2023-05-18 18:44:31.904925,0 days 00:00:00.431148,32,10000,0.98,0.0017387581093499759,10000,-2.855390702586228,big,0.01,256,PRUNED
483,483,82.9285884,2023-05-18 18:44:31.905775,2023-05-18 18:44:32.743071,0 days 00:00:00.837296,2048,100000,0.9,3.908974188783922e-05,1000,-1.491626226553624,big,0.08,4,PRUNED
484,484,60.4522918,2023-05-18 18:44:32.744597,2023-05-18 18:44:33.529679,0 days 00:00:00.785082,256,1000000,0.999,0.0022162610483475,1000,0.11165727617036655,big,0.01,16,PRUNED
485,485,30.0028932,2023-05-18 18:44:33.531426,2023-05-18 18:44:34.355743,0 days 00:00:00.824317,128,10000,0.99,0.002746835413040364,1000,-0.7799406684202466,big,0.005,256,PRUNED
486,486,13.466551599999999,2023-05-18 18:44:34.357142,2023-05-18 18:44:42.764805,0 days 00:00:08.407663,128,10000,0.995,2.6223008124854254e-05,0,-1.6461333278948043,small,0.01,128,PRUNED
487,487,65.7510656,2023-05-18 18:44:42.767390,2023-05-18 18:44:43.514860,0 days 00:00:00.747470,32,100000,0.9,7.228515608416198e-05,1000,-1.3356158700325704,big,0.005,4,PRUNED
488,488,80.0534922,2023-05-18 18:44:43.515792,2023-05-18 18:46:48.884763,0 days 00:02:05.368971,2048,100000,0.9,1.5171831364757499e-05,0,-0.2286870357807196,big,0.005,128,PRUNED
489,489,84.3918646,2023-05-18 18:44:49.770081,2023-05-18 18:47:25.510120,0 days 00:02:35.740039,2048,100000,0.9,0.0001376898647485406,0,-2.0639961338003396,big,0.005,8,PRUNED
490,490,36.30319239999999,2023-05-18 18:45:13.727497,2023-05-18 18:45:14.359471,0 days 00:00:00.631974,32,10000,0.98,0.001906799731722137,1000,-0.08968196556733954,big,0.005,256,PRUNED
491,491,47.02721220000001,2023-05-18 18:45:14.361237,2023-05-18 18:47:33.059185,0 days 00:02:18.697948,2048,100000,0.9,1.2383428341351419e-05,0,0.8500679592217067,big,0.01,64,PRUNED
492,492,42.5828056,2023-05-18 18:46:34.709892,2023-05-18 18:48:09.668901,0 days 00:01:34.959009,2048,100000,0.9,6.642324249277363e-05,0,-1.8181906798893603,big,0.08,4,PRUNED
493,493,97.39767739999999,2023-05-18 18:46:48.888240,2023-05-18 18:46:49.491803,0 days 00:00:00.603563,32,10000,0.9999,5.6981569514913164e-05,1000,-2.7524576464640877,big,0.005,4,PRUNED
494,494,23.028022799999995,2023-05-18 18:46:49.492773,2023-05-18 18:47:25.400138,0 days 00:00:35.907365,2048,100000,0.98,1.5602031229515753e-05,0,0.44186310192035705,small,0.01,16,PRUNED
495,495,30.2006908,2023-05-18 18:47:25.401332,2023-05-18 18:47:40.199152,0 days 00:00:14.797820,128,10000,0.98,0.0019506914547478425,0,-3.2342520778657327,big,0.01,256,PRUNED
496,496,55.392278999999995,2023-05-18 18:47:25.511405,2023-05-18 18:47:26.657884,0 days 00:00:01.146479,16,100000,0.9,1.0866316701971228e-05,20000,0.89614423371897,big,0.01,16,PRUNED
497,497,79.9409618,2023-05-18 18:47:26.659875,2023-05-18 18:47:27.443863,0 days 00:00:00.783988,128,10000,0.999,0.000993699641387253,10000,-3.378066704445336,big,0.01,256,PRUNED
498,498,127.148269,2023-05-18 18:47:27.447351,2023-05-18 18:47:59.108634,0 days 00:00:31.661283,512,100000,0.95,5.045188209870734e-05,0,-2.2336995210914843,big,0.001,4,PRUNED
499,499,201.2166418,2023-05-18 18:47:33.062168,2023-05-18 18:47:34.979290,0 days 00:00:01.917122,128,10000,0.95,7.481647144729479e-05,1000,-1.7782666708116839,big,0.005,4,COMPLETE
