,number,value,datetime_start,datetime_complete,duration,params_batch_size,params_buffer_size,params_gamma,params_learning_rate,params_learning_starts,params_log_std_init,params_net_arch,params_tau,params_train_freq,state
240,240,58.6575474,2023-05-18 15:55:37.724387,2023-05-18 15:56:00.846619,0 days 00:00:23.122232,16,1000000,0.9,0.006013857545252622,0,-3.75751896620426,big,0.05,1,PRUNED
241,241,,2023-05-18 15:55:46.396689,2023-05-18 15:56:51.995982,0 days 00:01:05.599293,1024,1000000,0.9,0.19385348715891113,0,-0.9535025035527934,big,0.05,32,PRUNED
242,242,168.6193238,2023-05-18 15:55:48.508755,2023-05-18 15:57:19.690121,0 days 00:01:31.181366,1024,1000000,0.9999,0.0004187774081970063,0,-2.7771013240266456,big,0.08,64,COMPLETE
243,243,178.8970502,2023-05-18 15:56:00.850265,2023-05-18 15:57:32.891174,0 days 00:01:32.040909,1024,1000000,0.9,0.012320562892167233,0,0.7009700257347729,big,0.02,16,COMPLETE
244,244,61.9317552,2023-05-18 15:56:26.119304,2023-05-18 15:57:05.231651,0 days 00:00:39.112347,128,1000000,0.9,0.0011179122336331215,0,0.8603110440624849,big,0.08,16,PRUNED
245,245,398.97992519999997,2023-05-18 15:56:51.997126,2023-05-18 15:57:29.970978,0 days 00:00:37.973852,128,1000000,0.95,0.0010047725880889126,0,0.14929021944180076,big,0.08,16,COMPLETE
246,246,228.91237460000002,2023-05-18 15:57:05.232696,2023-05-18 15:58:39.544968,0 days 00:01:34.312272,1024,1000000,0.99,0.0008688791865804893,0,-3.5731607356319453,big,0.08,128,COMPLETE
247,247,56.0870372,2023-05-18 15:57:19.691720,2023-05-18 15:58:52.364699,0 days 00:01:32.672979,1024,1000000,0.9,0.004471680767223406,0,-1.9536589804826456,big,0.08,16,PRUNED
248,248,85.1468844,2023-05-18 15:57:29.973567,2023-05-18 15:58:55.233857,0 days 00:01:25.260290,1024,1000000,0.9999,0.00024564383112460054,0,-2.779513996961574,big,0.02,64,PRUNED
249,249,169.3359584,2023-05-18 15:57:32.892496,2023-05-18 15:59:12.992680,0 days 00:01:40.100184,1024,1000000,0.9999,0.0002886863936106474,0,-2.315928187989962,big,0.08,64,COMPLETE
250,250,7.028252,2023-05-18 15:58:39.549673,2023-05-18 15:59:28.735034,0 days 00:00:49.185361,1024,1000000,0.99,0.0007655984468263244,0,-3.72823598156219,big,0.08,256,PRUNED
251,251,9.424375399999999,2023-05-18 15:58:52.366633,2023-05-18 16:00:14.591599,0 days 00:01:22.224966,1024,1000000,0.9999,3.075330532194729e-05,0,-3.8554305674390403,big,0.08,64,PRUNED
252,252,6.156038799999999,2023-05-18 15:58:55.234820,2023-05-18 16:00:05.620429,0 days 00:01:10.385609,1024,1000000,0.99,0.0007276952960183274,0,-3.0503520284921235,big,0.08,128,PRUNED
253,253,70.94235719999999,2023-05-18 15:59:12.998734,2023-05-18 16:00:30.019640,0 days 00:01:17.020906,1024,1000000,0.9999,0.0016517485206705325,0,-3.414843732344321,big,0.08,64,PRUNED
254,254,7.986572600000001,2023-05-18 15:59:28.736909,2023-05-18 16:00:34.450889,0 days 00:01:05.713980,1024,1000000,0.9999,4.552525210499093e-05,0,-1.4826762526574808,medium,0.08,64,PRUNED
255,255,39.088832,2023-05-18 16:00:05.621558,2023-05-18 16:01:23.403145,0 days 00:01:17.781587,1024,1000000,0.9999,0.00014432491680721262,0,-1.5350758765065744,big,0.08,64,PRUNED
256,256,488.5797528,2023-05-18 16:00:14.594724,2023-05-18 16:00:55.842204,0 days 00:00:41.247480,128,1000000,0.95,0.0008453696175161859,0,-0.8627074827294682,big,0.08,32,COMPLETE
257,257,20.909964799999997,2023-05-18 16:00:30.021118,2023-05-18 16:00:30.406803,0 days 00:00:00.385685,1024,1000000,0.999,0.18110606147070762,10000,-2.504673480125335,big,0.005,32,PRUNED
258,258,7.2045506,2023-05-18 16:00:30.410014,2023-05-18 16:01:12.441481,0 days 00:00:42.031467,256,1000000,0.9999,4.648759715624274e-05,0,-1.8441035653409834,big,0.08,64,PRUNED
259,259,22.235082799999997,2023-05-18 16:00:34.453128,2023-05-18 16:01:13.879672,0 days 00:00:39.426544,128,1000000,0.95,0.0008252002828492117,0,0.5623366044431938,big,0.08,16,PRUNED
260,260,122.45907940000002,2023-05-18 16:00:55.843880,2023-05-18 16:01:32.271079,0 days 00:00:36.427199,128,1000000,0.95,0.02569899094785206,0,0.27561266980700705,big,0.08,32,PRUNED
261,261,77.6913418,2023-05-18 16:01:12.442862,2023-05-18 16:01:45.071349,0 days 00:00:32.628487,128,1000000,0.95,0.00012834477722806477,0,0.9025125601751952,big,0.005,16,PRUNED
262,262,42.0945038,2023-05-18 16:01:13.880964,2023-05-18 16:01:15.871095,0 days 00:00:01.990131,2048,1000000,0.95,0.00034218380617400513,0,-0.8585859844080114,big,0.08,512,PRUNED
263,263,104.9330582,2023-05-18 16:01:15.872208,2023-05-18 16:01:47.401413,0 days 00:00:31.529205,128,1000000,0.95,0.0008366084239646988,0,-1.489762675752894,big,0.005,32,PRUNED
264,264,41.6915078,2023-05-18 16:01:23.403978,2023-05-18 16:01:52.826760,0 days 00:00:29.422782,128,1000000,0.95,0.00017707249058640482,0,-1.114762202769986,big,0.08,32,PRUNED
265,265,44.305706400000005,2023-05-18 16:01:32.272169,2023-05-18 16:02:03.515901,0 days 00:00:31.243732,128,1000000,0.95,1.0569087010240216e-05,0,-0.18932451294206354,big,0.08,32,PRUNED
266,266,193.36879380000002,2023-05-18 16:01:45.072241,2023-05-18 16:02:20.105444,0 days 00:00:35.033203,128,1000000,0.95,0.00035326189459815007,0,-1.3780387748819216,big,0.08,32,COMPLETE
267,267,25.8727938,2023-05-18 16:01:47.402476,2023-05-18 16:01:47.973488,0 days 00:00:00.571012,2048,1000000,0.9,0.0007106079544775532,1000,0.9056853727801866,big,0.08,512,PRUNED
268,268,12.183853999999998,2023-05-18 16:01:47.974621,2023-05-18 16:02:20.754548,0 days 00:00:32.779927,128,1000000,0.95,0.0008945680950914479,0,-0.861828839978884,big,0.08,32,PRUNED
269,269,20.871617000000004,2023-05-18 16:01:52.827693,2023-05-18 16:01:53.474182,0 days 00:00:00.646489,32,1000000,0.999,0.5649253850002118,1000,-3.4282847982362803,big,0.005,128,PRUNED
270,270,27.073945400000003,2023-05-18 16:01:53.475042,2023-05-18 16:01:53.953732,0 days 00:00:00.478690,1024,1000000,0.9,1.768893684027425e-05,1000,-0.9345370775396044,big,0.08,32,PRUNED
271,271,42.08140959999999,2023-05-18 16:01:53.954691,2023-05-18 16:02:15.745019,0 days 00:00:21.790328,16,1000000,0.95,0.00019128974786371627,0,-0.8840032492706654,big,0.08,16,PRUNED
272,272,202.59198640000002,2023-05-18 16:02:03.517041,2023-05-18 16:04:49.614933,0 days 00:02:46.097892,2048,1000000,0.9999,4.3602585058836054e-05,0,-0.08373211012764678,big,0.001,32,COMPLETE
273,273,34.03178760000001,2023-05-18 16:02:15.746243,2023-05-18 16:02:24.182178,0 days 00:00:08.435935,128,1000000,0.9,0.00019737672326878577,0,0.5937933522787218,small,0.08,256,PRUNED
274,274,10.5301246,2023-05-18 16:02:20.107588,2023-05-18 16:02:20.922900,0 days 00:00:00.815312,1024,1000000,0.99,0.007024816851411822,20000,-3.825545425794129,big,0.08,128,PRUNED
275,275,217.5341832,2023-05-18 16:02:20.755575,2023-05-18 16:03:53.147528,0 days 00:01:32.391953,1024,1000000,0.9,0.0034010808460833574,0,-0.6893287146729636,big,0.005,32,COMPLETE
276,276,186.77008080000002,2023-05-18 16:02:20.923774,2023-05-18 16:03:51.200735,0 days 00:01:30.276961,1024,1000000,0.9999,0.0017146678437067492,0,0.8140282635692361,big,0.01,16,COMPLETE
277,277,-0.46937120000000004,2023-05-18 16:02:24.183105,2023-05-18 16:05:13.958126,0 days 00:02:49.775021,2048,1000000,0.9,5.5275631335370174e-05,0,-0.27161285819623787,big,0.08,1,PRUNED
278,278,64.48989200000001,2023-05-18 16:03:51.207326,2023-05-18 16:05:24.996266,0 days 00:01:33.788940,1024,1000000,0.95,0.002292785650277765,0,0.4086721835072448,big,0.01,16,PRUNED
279,279,183.4208254,2023-05-18 16:03:53.150299,2023-05-18 16:05:28.870854,0 days 00:01:35.720555,1024,1000000,0.9999,0.0021100151651280426,0,0.8224465114547869,big,0.01,16,COMPLETE
280,280,130.0563534,2023-05-18 16:04:49.616393,2023-05-18 16:07:32.978138,0 days 00:02:43.361745,2048,1000000,0.9999,9.106977304859412e-05,0,-0.19970949527586745,big,0.001,32,PRUNED
281,281,8.2332508,2023-05-18 16:05:13.962357,2023-05-18 16:05:15.285848,0 days 00:00:01.323491,2048,1000000,0.9999,0.0001062718483457489,0,-0.9296583345490153,big,0.001,512,PRUNED
282,282,55.0383518,2023-05-18 16:05:15.290716,2023-05-18 16:06:49.377434,0 days 00:01:34.086718,1024,1000000,0.9999,0.0007854124249956482,0,0.44427439637524363,big,0.01,16,PRUNED
283,283,45.98913900000001,2023-05-18 16:05:24.999025,2023-05-18 16:06:57.078877,0 days 00:01:32.079852,2048,1000000,0.9999,1.1971215309726505e-05,0,0.9995346111304865,big,0.001,256,PRUNED
284,284,86.6925352,2023-05-18 16:05:28.874219,2023-05-18 16:07:04.731784,0 days 00:01:35.857565,1024,1000000,0.9999,0.00225103863694123,0,0.5880602974853013,big,0.01,16,PRUNED
285,285,65.20170479999999,2023-05-18 16:06:49.378996,2023-05-18 16:08:11.186474,0 days 00:01:21.807478,1024,1000000,0.9,0.001078348567788836,0,-0.3283156032990785,big,0.005,32,PRUNED
286,286,124.11499599999999,2023-05-18 16:06:57.080360,2023-05-18 16:08:49.747317,0 days 00:01:52.666957,2048,1000000,0.9999,7.37444818644356e-05,0,0.06284964893903938,medium,0.001,32,PRUNED
287,287,17.6911184,2023-05-18 16:07:04.732714,2023-05-18 16:08:27.197067,0 days 00:01:22.464353,1024,1000000,0.9,0.00045773302200956126,0,-0.5845514933299885,big,0.005,32,PRUNED
288,288,17.2720926,2023-05-18 16:07:32.978975,2023-05-18 16:07:33.565206,0 days 00:00:00.586231,2048,1000000,0.9,0.001385798540171608,1000,-0.8574757322240265,big,0.08,32,PRUNED
289,289,52.27967580000001,2023-05-18 16:07:33.566441,2023-05-18 16:07:59.228803,0 days 00:00:25.662362,32,1000000,0.9999,0.001591804855952402,0,0.432114688700408,medium,0.01,16,PRUNED
290,290,63.1850192,2023-05-18 16:07:59.232600,2023-05-18 16:09:25.555528,0 days 00:01:26.322928,1024,1000000,0.9,0.036893130680863105,0,0.4972491179808825,big,0.02,4,PRUNED
291,291,31.4617552,2023-05-18 16:08:11.187929,2023-05-18 16:08:11.903604,0 days 00:00:00.715675,1024,1000000,0.999,0.08829871197957535,1000,-2.466262512014576,big,0.02,32,PRUNED
292,292,39.265776200000005,2023-05-18 16:08:11.905283,2023-05-18 16:09:22.035422,0 days 00:01:10.130139,1024,10000,0.9999,0.0068252761655342555,0,0.15026673999218043,big,0.01,128,PRUNED
293,293,8.9924386,2023-05-18 16:08:27.198367,2023-05-18 16:09:14.253791,0 days 00:00:47.055424,1024,1000000,0.9,0.046118533553894114,0,0.9201452437335372,big,0.02,256,PRUNED
294,294,33.059691400000006,2023-05-18 16:08:49.750373,2023-05-18 16:08:50.483931,0 days 00:00:00.733558,2048,1000000,0.95,1.3120879961758895e-05,1000,-0.43542746097830787,big,0.001,4,PRUNED
295,295,211.31889739999997,2023-05-18 16:08:50.484681,2023-05-18 16:09:51.950298,0 days 00:01:01.465617,512,1000000,0.95,0.00282561072272496,0,-2.610947201191986,big,0.08,32,COMPLETE
296,296,79.94544599999999,2023-05-18 16:09:14.255988,2023-05-18 16:09:41.611270,0 days 00:00:27.355282,1024,100000,0.9999,0.009097840411348375,0,0.8046249533779856,small,0.01,16,PRUNED
297,297,95.30316,2023-05-18 16:09:22.037879,2023-05-18 16:09:53.343956,0 days 00:00:31.306077,64,1000000,0.9,0.004990737140154996,0,-3.782329895756519,big,0.08,1,PRUNED
298,298,29.895173399999997,2023-05-18 16:09:25.556952,2023-05-18 16:09:26.495541,0 days 00:00:00.938589,1024,1000000,0.9,0.035109067061972296,10000,0.9500971317886893,big,0.02,16,PRUNED
299,299,119.65621100000001,2023-05-18 16:09:26.496773,2023-05-18 16:10:04.247616,0 days 00:00:37.750843,128,10000,0.99,0.0002733020856255323,0,0.5853694638270173,big,0.08,16,PRUNED
300,300,14.9252828,2023-05-18 16:09:41.612939,2023-05-18 16:09:42.509642,0 days 00:00:00.896703,2048,1000000,0.999,1.0907424229291562e-05,1000,-0.20474466545420086,big,0.08,16,PRUNED
301,301,188.2921826,2023-05-18 16:09:42.510738,2023-05-18 16:10:15.663502,0 days 00:00:33.152764,64,1000000,0.9,0.00586726145376546,0,-3.792797206737002,medium,0.08,1,COMPLETE
302,302,60.1190934,2023-05-18 16:09:51.951883,2023-05-18 16:10:49.604700,0 days 00:00:57.652817,512,1000000,0.95,0.0030062710696542247,0,-2.7266798511843553,big,0.05,32,PRUNED
303,303,93.98142720000001,2023-05-18 16:09:53.345452,2023-05-18 16:10:13.558864,0 days 00:00:20.213412,512,1000000,0.95,0.001758633936506803,0,-2.6536463049189507,small,0.08,32,PRUNED
304,304,10.1254686,2023-05-18 16:10:04.249210,2023-05-18 16:10:04.928057,0 days 00:00:00.678847,2048,1000000,0.9,1.1297131147430908e-05,1000,-0.8323083118651329,medium,0.08,4,PRUNED
305,305,225.9863338,2023-05-18 16:10:04.930886,2023-05-18 16:11:08.672910,0 days 00:01:03.742024,512,1000000,0.95,0.0017931903191780564,0,-3.079684013702279,big,0.08,32,COMPLETE
306,306,64.3397742,2023-05-18 16:10:13.559959,2023-05-18 16:11:13.502005,0 days 00:00:59.942046,512,1000000,0.95,0.001608187732805759,0,-1.0167362593075597,big,0.01,32,PRUNED
307,307,123.83047780000001,2023-05-18 16:10:15.665160,2023-05-18 16:11:16.717348,0 days 00:01:01.052188,512,1000000,0.99,0.008139566705281442,0,-3.218263361805695,big,0.08,32,PRUNED
308,308,306.20241539999995,2023-05-18 16:10:49.605607,2023-05-18 16:11:30.193958,0 days 00:00:40.588351,128,10000,0.95,0.0007646995978653455,0,-1.544000216125303,big,0.08,64,COMPLETE
309,309,42.896345600000004,2023-05-18 16:11:08.674346,2023-05-18 16:11:44.642705,0 days 00:00:35.968359,128,1000000,0.9,0.002981588143586385,0,-2.974145967495434,medium,0.08,1,PRUNED
310,310,156.4414446,2023-05-18 16:11:13.504830,2023-05-18 16:12:10.366029,0 days 00:00:56.861199,512,1000000,0.9999,0.0017179129336780717,0,-2.4355064793207912,big,0.08,32,COMPLETE
311,311,18.574407200000003,2023-05-18 16:11:16.718490,2023-05-18 16:11:17.361965,0 days 00:00:00.643475,512,1000000,0.95,0.0008492427521903994,20000,-3.075706806672149,big,0.08,32,PRUNED
312,312,68.7861126,2023-05-18 16:11:17.363129,2023-05-18 16:11:46.378415,0 days 00:00:29.015286,64,1000000,0.9,0.02180977535279698,0,-3.6784161011780645,medium,0.08,16,PRUNED
313,313,331.9310854,2023-05-18 16:11:30.196764,2023-05-18 16:12:02.317876,0 days 00:00:32.121112,64,10000,0.9,0.0017467858820062994,0,-3.4293363182042325,medium,0.08,1,COMPLETE
314,314,76.250237,2023-05-18 16:11:44.644116,2023-05-18 16:12:19.439649,0 days 00:00:34.795533,128,10000,0.95,0.0011562081235602288,0,-2.3028134296848064,big,0.08,64,PRUNED
315,315,212.8732124,2023-05-18 16:11:46.379704,2023-05-18 16:12:18.818056,0 days 00:00:32.438352,64,10000,0.95,0.0015373707660168755,0,-1.2802609088606494,big,0.08,64,COMPLETE
316,316,519.6884956000001,2023-05-18 16:12:02.319935,2023-05-18 16:12:46.845000,0 days 00:00:44.525065,128,10000,0.95,0.0002633934064179854,0,-1.5544640553875415,big,0.08,64,COMPLETE
317,317,34.8699794,2023-05-18 16:12:10.367919,2023-05-18 16:13:06.341150,0 days 00:00:55.973231,512,1000000,0.95,0.007511533299657434,0,-1.8235516533577267,big,0.08,32,PRUNED
318,318,275.32415000000003,2023-05-18 16:12:18.819472,2023-05-18 16:12:59.945591,0 days 00:00:41.126119,128,10000,0.95,0.00043080860486375747,0,-1.2845823818540634,big,0.08,64,COMPLETE
319,319,114.749491,2023-05-18 16:12:19.441228,2023-05-18 16:12:50.057518,0 days 00:00:30.616290,64,10000,0.9,0.001387525950325022,0,-3.9930636433229996,medium,0.08,32,PRUNED
320,320,96.1738814,2023-05-18 16:12:46.847532,2023-05-18 16:13:40.774079,0 days 00:00:53.926547,512,100000,0.95,0.006653906241975007,0,-3.0166015719919352,big,0.08,32,PRUNED
321,321,181.5905828,2023-05-18 16:12:50.059397,2023-05-18 16:13:21.294979,0 days 00:00:31.235582,64,10000,0.95,0.00497496911373757,0,-1.2814243044646212,big,0.08,64,COMPLETE
322,322,39.799380199999995,2023-05-18 16:12:59.947508,2023-05-18 16:13:48.566121,0 days 00:00:48.618613,512,1000000,0.95,0.0001342636463745852,0,-2.9412097875947087,medium,0.08,32,PRUNED
323,323,68.9907672,2023-05-18 16:13:06.342724,2023-05-18 16:13:31.799040,0 days 00:00:25.456316,64,10000,0.95,0.00033712609420905764,0,-1.4477106503082215,big,0.08,64,PRUNED
324,324,105.4039926,2023-05-18 16:13:21.296705,2023-05-18 16:13:54.676815,0 days 00:00:33.380110,128,10000,0.95,0.002381480191552702,0,0.0811655467851824,big,0.08,64,PRUNED
325,325,30.1690246,2023-05-18 16:13:31.800086,2023-05-18 16:14:04.999498,0 days 00:00:33.199412,128,10000,0.95,2.1359749199521842e-05,0,-0.6790781492004608,big,0.08,64,PRUNED
326,326,44.5034772,2023-05-18 16:13:40.775369,2023-05-18 16:14:13.885386,0 days 00:00:33.110017,128,10000,0.95,5.997854774350699e-05,0,-2.20705169906008,big,0.02,64,PRUNED
327,327,97.3555402,2023-05-18 16:13:48.567986,2023-05-18 16:14:21.455364,0 days 00:00:32.887378,128,10000,0.95,0.00038945900482791616,0,-0.3142902091097646,big,0.05,64,PRUNED
328,328,19.2545944,2023-05-18 16:13:54.681541,2023-05-18 16:14:23.197429,0 days 00:00:28.515888,64,10000,0.9,6.595087490068245e-05,0,-3.1560769446985866,medium,0.08,1,PRUNED
329,329,51.3784258,2023-05-18 16:14:05.000776,2023-05-18 16:14:41.114283,0 days 00:00:36.113507,128,10000,0.95,0.0001257545357580235,0,-1.061657447216614,big,0.005,64,PRUNED
330,330,149.323939,2023-05-18 16:14:13.887993,2023-05-18 16:14:45.880457,0 days 00:00:31.992464,64,10000,0.999,0.0002971426787790814,0,-3.3942915054669793,medium,0.08,1,PRUNED
331,331,0.8331466000000001,2023-05-18 16:14:21.456402,2023-05-18 16:15:01.031396,0 days 00:00:39.574994,128,100000,0.95,9.440026823463904e-05,0,-0.9132139640298478,big,0.08,1,PRUNED
332,332,14.240377,2023-05-18 16:14:23.198491,2023-05-18 16:14:24.091438,0 days 00:00:00.892947,64,10000,0.9999,0.010145254230617703,1000,-2.712416127941568,big,0.02,32,PRUNED
333,333,15.586452400000002,2023-05-18 16:14:24.093022,2023-05-18 16:14:24.946150,0 days 00:00:00.853128,64,10000,0.9,0.027574037834706595,20000,-2.9528907428474485,medium,0.08,1,PRUNED
334,334,20.1109928,2023-05-18 16:14:24.947296,2023-05-18 16:14:25.746744,0 days 00:00:00.799448,2048,1000000,0.9,1.6807463957985244e-05,1000,-1.011656834321062,big,0.01,4,PRUNED
335,335,8.1066904,2023-05-18 16:14:25.748146,2023-05-18 16:15:04.106074,0 days 00:00:38.357928,128,10000,0.95,3.3088470122305186e-05,0,-2.406884982196514,big,0.08,1,PRUNED
336,336,119.91188160000002,2023-05-18 16:14:41.117516,2023-05-18 16:15:35.498463,0 days 00:00:54.380947,512,1000000,0.95,0.00030856383143737563,0,-3.1712868771796714,big,0.08,32,PRUNED
337,337,81.5493232,2023-05-18 16:14:45.881520,2023-05-18 16:15:16.981061,0 days 00:00:31.099541,64,10000,0.9,0.011503613301702782,0,-3.6267293419359325,medium,0.08,1,PRUNED
338,338,157.36689180000002,2023-05-18 16:15:01.034915,2023-05-18 16:15:29.107858,0 days 00:00:28.072943,64,1000000,0.95,0.013588580725316038,0,-3.1534457059636383,big,0.08,32,PRUNED
339,339,15.347386600000002,2023-05-18 16:15:04.107679,2023-05-18 16:15:05.014032,0 days 00:00:00.906353,1024,1000000,0.999,0.40077432515673306,1000,-2.4902380636087376,big,0.005,16,PRUNED
340,340,24.369651,2023-05-18 16:15:05.015206,2023-05-18 16:17:14.201701,0 days 00:02:09.186495,2048,10000,0.9999,2.248311765197346e-05,0,0.23217659493660378,big,0.08,32,PRUNED
341,341,62.0285602,2023-05-18 16:15:16.982824,2023-05-18 16:15:18.037741,0 days 00:00:01.054917,128,10000,0.95,0.00030518541695903975,10000,-1.391699265500296,big,0.08,64,PRUNED
342,342,5.064859,2023-05-18 16:15:18.045001,2023-05-18 16:15:41.547952,0 days 00:00:23.502951,16,1000000,0.95,0.0023660558466912242,0,-3.1604352659596624,big,0.08,32,PRUNED
343,343,39.8857708,2023-05-18 16:15:29.110772,2023-05-18 16:15:54.849052,0 days 00:00:25.738280,1024,1000000,0.9,0.017661729440466616,0,-1.6985354961194274,small,0.005,32,PRUNED
344,344,66.55677399999999,2023-05-18 16:15:35.500343,2023-05-18 16:15:36.597560,0 days 00:00:01.097217,2048,1000000,0.99,0.001409238097067514,20000,0.9006614249940275,big,0.08,32,PRUNED
345,345,107.6315746,2023-05-18 16:15:36.601067,2023-05-18 16:16:11.390608,0 days 00:00:34.789541,128,1000000,0.9,0.0012024744496423186,0,0.8543269450148543,big,0.001,32,PRUNED
346,346,40.262412600000005,2023-05-18 16:15:41.549313,2023-05-18 16:16:05.082044,0 days 00:00:23.532731,16,10000,0.95,0.00023055722930273565,0,-1.121611212234589,big,0.08,8,PRUNED
347,347,26.4864074,2023-05-18 16:15:54.852057,2023-05-18 16:15:56.956789,0 days 00:00:02.104732,1024,1000000,0.9,0.025222426728213686,0,-0.07173787479731386,big,0.005,512,PRUNED
348,348,56.68184040000001,2023-05-18 16:15:56.959303,2023-05-18 16:16:22.656330,0 days 00:00:25.697027,32,1000000,0.95,0.0008812315208800858,0,-3.1271077507761857,big,0.08,1,PRUNED
349,349,197.5285066,2023-05-18 16:16:05.083202,2023-05-18 16:16:34.041081,0 days 00:00:28.957879,64,10000,0.9,0.002140133945103231,0,-2.1774647972999035,medium,0.08,64,COMPLETE
350,350,23.8424896,2023-05-18 16:16:11.392095,2023-05-18 16:16:12.344286,0 days 00:00:00.952191,128,1000000,0.9,2.881624391982355e-05,1000,-0.8847349238871933,big,0.08,4,PRUNED
351,351,14.2011886,2023-05-18 16:16:12.348888,2023-05-18 16:16:43.587538,0 days 00:00:31.238650,128,10000,0.95,3.924003200675488e-05,0,-2.696705241088481,medium,0.08,64,PRUNED
352,352,187.1681576,2023-05-18 16:16:22.657314,2023-05-18 16:16:56.876261,0 days 00:00:34.218947,128,10000,0.95,0.000845591569351662,0,-0.9932402585007332,big,0.08,16,COMPLETE
353,353,87.26110660000002,2023-05-18 16:16:34.044856,2023-05-18 16:17:41.620138,0 days 00:01:07.575282,1024,100000,0.98,0.0003585296703231961,0,-3.9299253768574705,big,0.08,128,PRUNED
354,354,110.60462439999999,2023-05-18 16:16:43.590011,2023-05-18 16:17:15.059454,0 days 00:00:31.469443,128,10000,0.99,0.000440172459462401,0,-1.66107031432104,big,0.08,64,PRUNED
355,355,37.170632,2023-05-18 16:16:56.878398,2023-05-18 16:17:32.329827,0 days 00:00:35.451429,128,10000,0.98,7.14891854747879e-05,0,-2.365804010738106,big,0.08,64,PRUNED
356,356,112.83089180000002,2023-05-18 16:17:14.203302,2023-05-18 16:18:14.613365,0 days 00:01:00.410063,512,1000000,0.95,0.002403371158676004,0,-3.561235450551591,big,0.08,4,PRUNED
357,357,137.41762119999999,2023-05-18 16:17:15.061047,2023-05-18 16:17:17.716752,0 days 00:00:02.655705,1024,1000000,0.999,0.888124308955911,1000,-1.687321210523734,big,0.005,32,PRUNED
358,358,60.8401662,2023-05-18 16:17:17.719772,2023-05-18 16:17:19.140689,0 days 00:00:01.420917,2048,1000000,0.9,1.7539093819901263e-05,20000,-2.000285408508529,big,0.08,4,PRUNED
359,359,77.0996132,2023-05-18 16:17:19.143590,2023-05-18 16:17:20.655823,0 days 00:00:01.512233,1024,10000,0.999,0.254039126641767,1000,-3.0121114077996913,medium,0.005,32,PRUNED
360,360,190.12803,2023-05-18 16:17:20.659707,2023-05-18 16:18:05.960129,0 days 00:00:45.300422,256,10000,0.95,0.0005074419681921948,0,-1.785846098335557,big,0.08,64,COMPLETE
