,number,value,datetime_start,datetime_complete,duration,params_batch_size,params_buffer_size,params_gamma,params_learning_rate,params_learning_starts,params_log_std_init,params_net_arch,params_tau,params_train_freq,state
361,361,226.2026812,2023-05-18 16:17:32.335378,2023-05-18 16:17:33.779013,0 days 00:00:01.443635,64,1000000,0.9999,0.08023978202872574,1000,-3.233004447451443,small,0.02,64,COMPLETE
362,362,30.977059199999996,2023-05-18 16:17:33.780761,2023-05-18 16:17:34.811836,0 days 00:00:01.031075,128,10000,0.95,0.0021232712791762797,20000,-1.3769341889961626,big,0.08,64,PRUNED
363,363,6.6868662,2023-05-18 16:17:34.827163,2023-05-18 16:20:07.259104,0 days 00:02:32.431941,2048,1000000,0.9,4.576154672333938e-05,0,-0.4124793337177438,big,0.05,32,PRUNED
364,364,93.13937860000001,2023-05-18 16:17:41.621876,2023-05-18 16:18:13.308224,0 days 00:00:31.686348,128,10000,0.9999,0.0012955163148773243,0,-0.9453679452573318,big,0.08,64,PRUNED
365,365,20.7266598,2023-05-18 16:18:05.961950,2023-05-18 16:18:06.861786,0 days 00:00:00.899836,2048,10000,0.9999,0.01882557985965264,1000,-2.424698030932531,big,0.005,32,PRUNED
366,366,106.08593060000001,2023-05-18 16:18:06.865447,2023-05-18 16:18:40.841475,0 days 00:00:33.976028,128,1000000,0.99,0.000549462944107794,0,0.36679094354091585,big,0.08,8,PRUNED
367,367,41.2376158,2023-05-18 16:18:13.309163,2023-05-18 16:19:26.380029,0 days 00:01:13.070866,1024,1000000,0.999,0.000137023287436534,0,-3.1745745193894255,big,0.02,128,PRUNED
368,368,48.334517600000005,2023-05-18 16:18:14.616332,2023-05-18 16:20:53.304699,0 days 00:02:38.688367,2048,10000,0.99,4.601884318447155e-05,0,-0.18297159340771305,big,0.001,32,PRUNED
369,369,20.901985,2023-05-18 16:18:40.844804,2023-05-18 16:18:41.202330,0 days 00:00:00.357526,64,1000000,0.9999,0.08297406947860259,1000,-3.3940013367284054,small,0.02,64,PRUNED
370,370,40.440119,2023-05-18 16:18:41.203915,2023-05-18 16:18:42.153854,0 days 00:00:00.949939,1024,1000000,0.9,0.40579428252501387,1000,-2.7926115744560365,big,0.005,32,PRUNED
371,371,38.760973,2023-05-18 16:18:42.154683,2023-05-18 16:19:52.633108,0 days 00:01:10.478425,1024,1000000,0.999,0.0001936494336463336,0,-3.6296460311648495,big,0.08,128,PRUNED
372,372,62.6779988,2023-05-18 16:19:26.381917,2023-05-18 16:19:57.615645,0 days 00:00:31.233728,64,10000,0.9,0.0008634597753224394,0,-2.957146881206095,medium,0.001,1,PRUNED
373,373,64.1453028,2023-05-18 16:19:52.634166,2023-05-18 16:19:53.256716,0 days 00:00:00.622550,64,10000,0.9999,0.20332044194085158,1000,-2.992613859190781,small,0.005,64,PRUNED
374,374,53.589506199999995,2023-05-18 16:19:53.258152,2023-05-18 16:21:21.440425,0 days 00:01:28.182273,1024,1000000,0.9999,0.0001411366356183932,0,0.866468566416993,big,0.001,32,PRUNED
375,375,8.3608388,2023-05-18 16:19:57.616613,2023-05-18 16:21:20.100783,0 days 00:01:22.484170,1024,10000,0.95,3.88174298702538e-05,0,-2.3578829652717266,big,0.08,64,PRUNED
376,376,90.7392968,2023-05-18 16:20:07.260318,2023-05-18 16:21:07.605130,0 days 00:01:00.344812,1024,1000000,0.9,0.0004988022858334705,0,-3.60388705259578,medium,0.08,128,PRUNED
377,377,23.9586228,2023-05-18 16:20:53.305970,2023-05-18 16:23:30.888453,0 days 00:02:37.582483,2048,100000,0.9,1.0606695152668284e-05,0,-0.7777759298885631,big,0.01,32,PRUNED
378,378,8.7757884,2023-05-18 16:21:07.607385,2023-05-18 16:23:13.322698,0 days 00:02:05.715313,2048,1000000,0.9,4.676246006859347e-05,0,-0.6366692383921069,big,0.08,128,PRUNED
379,379,24.1413304,2023-05-18 16:21:20.101902,2023-05-18 16:21:20.788508,0 days 00:00:00.686606,32,1000000,0.9,1.1190104979635507e-05,20000,0.5817770084290524,big,0.08,32,PRUNED
380,380,74.6561624,2023-05-18 16:21:20.792811,2023-05-18 16:21:53.425740,0 days 00:00:32.632929,128,1000000,0.95,0.003198821246272981,0,-0.902281221340162,big,0.01,16,PRUNED
381,381,6.4597012000000005,2023-05-18 16:21:21.441445,2023-05-18 16:21:22.040831,0 days 00:00:00.599386,64,1000000,0.9999,0.09336522918147323,10000,-2.683049797393368,small,0.02,64,PRUNED
382,382,83.16640199999999,2023-05-18 16:21:22.042167,2023-05-18 16:21:42.378807,0 days 00:00:20.336640,64,1000000,0.9,0.0010341960469289451,0,-3.790601147902182,big,0.08,128,PRUNED
383,383,41.620872,2023-05-18 16:21:42.379811,2023-05-18 16:24:17.904268,0 days 00:02:35.524457,2048,1000000,0.9999,0.0008428786795875448,0,0.7956783955563175,big,0.02,32,PRUNED
384,384,57.913931000000005,2023-05-18 16:21:53.427967,2023-05-18 16:22:01.202053,0 days 00:00:07.774086,128,10000,0.95,0.0003189063126789085,0,-1.8617493195760955,small,0.08,128,PRUNED
385,385,25.515171199999997,2023-05-18 16:22:01.206562,2023-05-18 16:22:02.166884,0 days 00:00:00.960322,512,1000000,0.9,2.681188675538669e-05,1000,-0.536369873587603,big,0.08,256,PRUNED
386,386,87.6944502,2023-05-18 16:22:02.167840,2023-05-18 16:24:39.242797,0 days 00:02:37.074957,2048,10000,0.9,0.001028715943532772,0,0.8615411121975008,big,0.005,32,PRUNED
387,387,63.47675240000001,2023-05-18 16:23:13.324124,2023-05-18 16:23:41.573334,0 days 00:00:28.249210,128,100000,0.95,0.0014546613157495419,0,-1.8696253760679227,big,0.01,64,PRUNED
388,388,42.8353076,2023-05-18 16:23:30.891126,2023-05-18 16:23:31.877884,0 days 00:00:00.986758,1024,1000000,0.9999,0.027242108261000694,1000,-3.613842319560029,small,0.02,512,PRUNED
389,389,77.54480620000001,2023-05-18 16:23:31.881046,2023-05-18 16:26:02.399037,0 days 00:02:30.517991,2048,1000000,0.9999,0.00024853789500056266,0,0.620732799162052,big,0.005,32,PRUNED
390,390,123.39590740000001,2023-05-18 16:23:41.574334,2023-05-18 16:24:13.559493,0 days 00:00:31.985159,64,100000,0.95,0.0005505973665698371,0,-3.6754833765237747,medium,0.08,1,PRUNED
391,391,48.7789834,2023-05-18 16:24:13.561016,2023-05-18 16:25:19.052581,0 days 00:01:05.491565,1024,1000000,0.99,0.016387931870246286,0,-3.560889033765351,big,0.05,128,PRUNED
392,392,50.8875426,2023-05-18 16:24:17.905575,2023-05-18 16:24:35.238731,0 days 00:00:17.333156,32,100000,0.95,0.002147254708166782,0,-1.1267254717628923,big,0.08,64,PRUNED
393,393,91.60615639999999,2023-05-18 16:24:35.241464,2023-05-18 16:27:03.986878,0 days 00:02:28.745414,2048,1000000,0.9999,1.1340166168727666e-05,0,0.8046711096956661,big,0.05,32,PRUNED
394,394,52.04214340000001,2023-05-18 16:24:39.243825,2023-05-18 16:27:07.291611,0 days 00:02:28.047786,2048,1000000,0.95,0.00012960532312105054,0,0.851729523390032,big,0.08,32,PRUNED
395,395,120.0001524,2023-05-18 16:25:19.053538,2023-05-18 16:25:44.480292,0 days 00:00:25.426754,128,10000,0.95,0.0013045912752125354,0,-1.7113965745043727,big,0.001,64,PRUNED
396,396,52.475368200000005,2023-05-18 16:25:44.481349,2023-05-18 16:25:44.989932,0 days 00:00:00.508583,64,1000000,0.9,2.5957719980451982e-05,1000,-0.11042874759751467,big,0.08,4,PRUNED
397,397,25.794007799999996,2023-05-18 16:25:44.990844,2023-05-18 16:25:45.576418,0 days 00:00:00.585574,64,10000,0.9999,0.0007498009973275763,1000,-1.5565070035227837,big,0.005,32,PRUNED
398,398,215.416934,2023-05-18 16:25:45.577625,2023-05-18 16:26:23.859094,0 days 00:00:38.281469,2048,1000000,0.98,0.0008527941032307893,0,0.29038497681702596,small,0.08,16,COMPLETE
399,399,14.6152354,2023-05-18 16:26:02.400335,2023-05-18 16:26:02.843759,0 days 00:00:00.443424,256,10000,0.95,0.11878517576350452,1000,-3.685830316119661,small,0.02,64,PRUNED
400,400,23.4157996,2023-05-18 16:26:02.844746,2023-05-18 16:28:02.634491,0 days 00:01:59.789745,2048,1000000,0.99,7.906344214302435e-05,0,-3.654074811379159,big,0.08,128,PRUNED
401,401,91.07864760000001,2023-05-18 16:26:23.860458,2023-05-18 16:27:03.719232,0 days 00:00:39.858774,2048,1000000,0.98,0.0008366999332112343,0,-0.1773085420867201,small,0.08,16,PRUNED
402,402,165.0531926,2023-05-18 16:27:03.728446,2023-05-18 16:27:48.272870,0 days 00:00:44.544424,256,1000000,0.95,0.0009411423174248533,0,0.17853581413507272,big,0.08,64,COMPLETE
403,403,179.8226422,2023-05-18 16:27:03.989383,2023-05-18 16:28:31.764765,0 days 00:01:27.775382,1024,1000000,0.98,0.035272680273175136,0,-3.8270300447091716,big,0.08,128,COMPLETE
404,404,48.350743,2023-05-18 16:27:07.298249,2023-05-18 16:27:08.103152,0 days 00:00:00.804903,64,10000,0.95,0.03428503097643986,10000,-3.960475326923947,small,0.02,64,PRUNED
405,405,16.4010242,2023-05-18 16:27:08.104391,2023-05-18 16:29:41.515371,0 days 00:02:33.410980,2048,1000000,0.99,2.6393087883357082e-05,0,-1.759172415373662,big,0.08,32,PRUNED
406,406,2.7253714,2023-05-18 16:27:48.275183,2023-05-18 16:28:29.447025,0 days 00:00:41.171842,2048,100000,0.98,0.00015849782719446054,0,0.5246543933246297,small,0.08,16,PRUNED
407,407,25.507908,2023-05-18 16:28:02.637634,2023-05-18 16:28:03.136789,0 days 00:00:00.499155,64,10000,0.95,0.22571180058936097,1000,-3.1573226312848064,small,0.01,512,PRUNED
408,408,108.6121636,2023-05-18 16:28:03.138127,2023-05-18 16:28:04.403567,0 days 00:00:01.265440,2048,1000000,0.999,0.07779385216976942,1000,-3.7636086689821076,big,0.005,32,PRUNED
409,409,60.230827999999995,2023-05-18 16:28:04.404613,2023-05-18 16:30:32.089196,0 days 00:02:27.684583,2048,1000000,0.95,0.0009312625689957434,0,-3.905286210330719,big,0.08,32,PRUNED
410,410,177.8073374,2023-05-18 16:28:29.451430,2023-05-18 16:28:45.406823,0 days 00:00:15.955393,128,1000000,0.95,0.0008423777778832339,0,-1.127489884695132,small,0.08,16,COMPLETE
411,411,43.079634,2023-05-18 16:28:31.765996,2023-05-18 16:28:53.160153,0 days 00:00:21.394157,16,1000000,0.9,0.0003538564479466962,0,0.27322156168295963,big,0.08,32,PRUNED
412,412,39.2170348,2023-05-18 16:28:45.408764,2023-05-18 16:28:46.284580,0 days 00:00:00.875816,128,10000,0.95,0.00011721462064245703,1000,-1.4502071636715128,big,0.01,64,PRUNED
413,413,21.804222399999997,2023-05-18 16:28:46.285444,2023-05-18 16:28:46.951840,0 days 00:00:00.666396,64,10000,0.999,0.17587178017041327,1000,-3.5775965218334886,small,0.02,1,PRUNED
414,414,56.595791600000005,2023-05-18 16:28:46.953044,2023-05-18 16:31:07.164169,0 days 00:02:20.211125,2048,10000,0.95,0.0009170962255807037,0,-1.9064245148515608,big,0.01,64,PRUNED
415,415,124.95239839999999,2023-05-18 16:28:53.162536,2023-05-18 16:29:33.411189,0 days 00:00:40.248653,256,100000,0.9,0.00020036506056960696,0,0.26875172324552243,big,0.08,16,PRUNED
416,416,40.2265448,2023-05-18 16:29:33.418739,2023-05-18 16:31:59.541769,0 days 00:02:26.123030,2048,1000000,0.99,0.00012838574269136255,0,-0.9004168901229549,big,0.08,32,PRUNED
417,417,5.686844,2023-05-18 16:29:41.517911,2023-05-18 16:30:09.559345,0 days 00:00:28.041434,128,10000,0.95,0.001746427728261927,0,-2.118679690464395,big,0.08,32,PRUNED
418,418,160.8066696,2023-05-18 16:30:09.563459,2023-05-18 16:30:38.928736,0 days 00:00:29.365277,32,10000,0.9,0.002686462960169894,0,-2.8736893424299463,medium,0.08,1,PRUNED
419,419,204.53896279999998,2023-05-18 16:30:32.092980,2023-05-18 16:30:57.083292,0 days 00:00:24.990312,32,1000000,0.99,0.0005108858578144812,0,-3.5577336169318556,big,0.08,4,COMPLETE
420,420,174.31858259999998,2023-05-18 16:30:38.930526,2023-05-18 16:31:07.910524,0 days 00:00:28.979998,64,100000,0.9,0.0003123587415155779,0,0.526898671738238,big,0.08,32,COMPLETE
421,421,176.6685494,2023-05-18 16:30:57.084464,2023-05-18 16:32:23.141755,0 days 00:01:26.057291,1024,1000000,0.99,0.006379054281081149,0,-3.880086348509311,big,0.08,4,COMPLETE
422,422,67.68343840000001,2023-05-18 16:31:07.165403,2023-05-18 16:31:08.382135,0 days 00:00:01.216732,2048,10000,0.9,2.219174288243267e-05,1000,0.3170760797526908,big,0.08,8,PRUNED
423,423,19.086885600000002,2023-05-18 16:31:07.924234,2023-05-18 16:31:33.031885,0 days 00:00:25.107651,32,1000000,0.999,4.335554189441473e-05,0,-3.805762982413772,big,0.08,4,PRUNED
424,424,18.8971014,2023-05-18 16:31:08.383663,2023-05-18 16:31:34.118880,0 days 00:00:25.735217,32,1000000,0.99,0.006392397323081802,0,-3.8976381479836664,big,0.08,4,PRUNED
425,425,108.16476580000001,2023-05-18 16:31:33.035210,2023-05-18 16:31:33.967678,0 days 00:00:00.932468,2048,1000000,0.98,0.00021057250218809177,1000,0.8829502703032628,small,0.08,16,PRUNED
426,426,29.578322800000002,2023-05-18 16:31:33.971413,2023-05-18 16:32:06.132055,0 days 00:00:32.160642,64,10000,0.999,0.00030426660761214753,0,-1.5322217263962425,big,0.08,8,PRUNED
427,427,55.4755746,2023-05-18 16:31:34.121682,2023-05-18 16:32:00.434314,0 days 00:00:26.312632,32,1000000,0.99,0.0007487551533927636,0,-3.8491939697051523,big,0.005,4,PRUNED
428,428,21.057510999999998,2023-05-18 16:31:59.543199,2023-05-18 16:32:00.488001,0 days 00:00:00.944802,2048,1000000,0.9,1.042321952999408e-05,1000,-0.04974654746422033,big,0.08,32,PRUNED
429,429,108.8988188,2023-05-18 16:32:00.438062,2023-05-18 16:32:01.610401,0 days 00:00:01.172339,1024,1000000,0.9,0.01288655575669883,20000,-0.8312776076234372,big,0.005,32,PRUNED
430,430,39.04277939999999,2023-05-18 16:32:00.488938,2023-05-18 16:33:17.811283,0 days 00:01:17.322345,1024,1000000,0.98,0.01045291335309251,0,-0.029124491261084406,big,0.005,32,PRUNED
431,431,94.767741,2023-05-18 16:32:01.611432,2023-05-18 16:32:02.760933,0 days 00:00:01.149501,32,10000,0.95,0.0004833722930349436,1000,-1.312689773736727,big,0.08,64,PRUNED
432,432,61.306662200000005,2023-05-18 16:32:02.763597,2023-05-18 16:32:04.147415,0 days 00:00:01.383818,64,1000000,0.9999,0.054985953450526544,1000,-2.9337682877536597,medium,0.05,64,PRUNED
433,433,16.4397616,2023-05-18 16:32:04.149320,2023-05-18 16:32:04.798068,0 days 00:00:00.648748,128,1000000,0.95,0.0010817786682856146,20000,0.11837408588814065,big,0.08,256,PRUNED
434,434,38.723432,2023-05-18 16:32:04.799154,2023-05-18 16:32:30.062611,0 days 00:00:25.263457,32,1000000,0.9999,0.00032698507115041234,0,-2.682298623575277,big,0.08,4,PRUNED
435,435,611.653431,2023-05-18 16:32:06.133336,2023-05-18 16:34:45.704831,0 days 00:02:39.571495,2048,1000000,0.9,0.00090115557310882,0,0.21729247498810936,big,0.08,256,COMPLETE
436,436,17.522239199999998,2023-05-18 16:32:23.143319,2023-05-18 16:32:23.858699,0 days 00:00:00.715380,128,100000,0.95,0.0016210437961965314,1000,-1.6415454233352271,big,0.08,64,PRUNED
437,437,8.6625804,2023-05-18 16:32:23.859943,2023-05-18 16:32:24.492911,0 days 00:00:00.632968,64,1000000,0.9999,0.5130034837794806,1000,-1.7943395206711708,small,0.02,1,PRUNED
438,438,91.5138812,2023-05-18 16:32:24.493971,2023-05-18 16:32:58.688127,0 days 00:00:34.194156,128,1000000,0.9,7.72863614538172e-05,0,0.6835769673765582,big,0.08,32,PRUNED
439,439,35.5696822,2023-05-18 16:32:30.064418,2023-05-18 16:32:51.113141,0 days 00:00:21.048723,32,1000000,0.99,2.0273727568598468e-05,0,-2.9959731316123444,big,0.08,4,PRUNED
440,440,13.199014199999999,2023-05-18 16:32:51.115952,2023-05-18 16:32:51.948247,0 days 00:00:00.832295,64,10000,0.95,0.04750970215046339,1000,-3.552788461841885,small,0.02,16,PRUNED
441,441,100.50453280000002,2023-05-18 16:32:51.949581,2023-05-18 16:32:53.049049,0 days 00:00:01.099468,64,1000000,0.99,0.07275953273859044,1000,-1.653738339445932,small,0.02,64,PRUNED
442,442,31.281295999999998,2023-05-18 16:32:53.049981,2023-05-18 16:33:04.874452,0 days 00:00:11.824471,128,10000,0.999,0.003467608064651286,0,-1.200450300883068,small,0.08,64,PRUNED
443,443,50.6905072,2023-05-18 16:32:58.690228,2023-05-18 16:35:31.756669,0 days 00:02:33.066441,2048,1000000,0.9,0.002141635043681696,0,-1.9215883313127418,big,0.005,16,PRUNED
444,444,16.3132286,2023-05-18 16:33:04.876719,2023-05-18 16:33:05.405217,0 days 00:00:00.528498,2048,100000,0.9,8.09213979659755e-05,1000,-0.8500369008374299,big,0.08,4,PRUNED
445,445,86.25728260000001,2023-05-18 16:33:05.407065,2023-05-18 16:33:33.120927,0 days 00:00:27.713862,64,100000,0.9,0.002629118576304526,0,-3.590325431935685,big,0.02,1,PRUNED
446,446,24.9284156,2023-05-18 16:33:17.812293,2023-05-18 16:33:18.380362,0 days 00:00:00.568069,32,1000000,0.99,0.00034118569976728457,20000,-3.7324804532683933,big,0.08,4,PRUNED
447,447,124.813822,2023-05-18 16:33:18.386065,2023-05-18 16:34:02.449190,0 days 00:00:44.063125,512,1000000,0.95,0.015307474202028054,0,-2.5567854068383182,big,0.08,128,PRUNED
448,448,44.028498400000004,2023-05-18 16:33:33.122077,2023-05-18 16:34:13.735114,0 days 00:00:40.613037,2048,1000000,0.98,0.0033650861937590186,0,-1.4248369276593835,small,0.05,16,PRUNED
449,449,17.088097400000002,2023-05-18 16:34:02.450517,2023-05-18 16:34:03.112909,0 days 00:00:00.662392,512,1000000,0.95,0.005317323275951526,10000,-3.4320246566637875,big,0.08,32,PRUNED
450,450,24.8160326,2023-05-18 16:34:03.113793,2023-05-18 16:35:29.108404,0 days 00:01:25.994611,1024,1000000,0.999,0.04794315624823109,0,-3.1765867808326047,big,0.005,32,PRUNED
451,451,85.24780260000001,2023-05-18 16:34:13.736887,2023-05-18 16:36:49.090080,0 days 00:02:35.353193,2048,10000,0.9,0.0010738971804432995,0,-0.4181403802953509,big,0.08,32,PRUNED
452,452,46.4361642,2023-05-18 16:34:45.706132,2023-05-18 16:35:22.655007,0 days 00:00:36.948875,128,1000000,0.95,0.009445713034886692,0,0.024686616056529664,medium,0.08,16,PRUNED
453,453,36.1072926,2023-05-18 16:35:22.656052,2023-05-18 16:36:18.103316,0 days 00:00:55.447264,512,1000000,0.95,0.00025230130834650227,0,-1.8444877898094,big,0.08,64,PRUNED
454,454,21.3597574,2023-05-18 16:35:29.109226,2023-05-18 16:35:29.643370,0 days 00:00:00.534144,64,1000000,0.95,0.056319144422137,1000,-3.079806247330133,small,0.02,64,PRUNED
455,455,57.971586,2023-05-18 16:35:29.646365,2023-05-18 16:37:52.862202,0 days 00:02:23.215837,2048,1000000,0.9,0.04501490839096651,0,0.46360017014795063,big,0.08,64,PRUNED
456,456,12.390612200000001,2023-05-18 16:35:31.757686,2023-05-18 16:35:33.113777,0 days 00:00:01.356091,128,1000000,0.95,0.005915975031815362,0,-0.6227600471830865,big,0.08,512,PRUNED
457,457,59.42586659999999,2023-05-18 16:35:33.123788,2023-05-18 16:36:32.329607,0 days 00:00:59.205819,512,1000000,0.95,0.0032864266518599903,0,-2.551979166450549,big,0.001,1,PRUNED
458,458,39.0645512,2023-05-18 16:36:18.107732,2023-05-18 16:36:40.263865,0 days 00:00:22.156133,256,1000000,0.9,0.014143250819418437,0,0.22129448244827365,big,0.08,256,PRUNED
459,459,5.7638978,2023-05-18 16:36:32.330755,2023-05-18 16:37:59.270429,0 days 00:01:26.939674,2048,1000000,0.98,0.0001091739324891425,0,-0.7759725562779692,big,0.08,256,PRUNED
460,460,75.1825826,2023-05-18 16:36:40.265837,2023-05-18 16:38:07.513552,0 days 00:01:27.247715,2048,1000000,0.9,0.0008467461557721536,0,0.7799801415991795,big,0.08,256,PRUNED
461,461,92.8351176,2023-05-18 16:36:49.096992,2023-05-18 16:38:15.337446,0 days 00:01:26.240454,2048,1000000,0.9,0.006806199479168909,0,0.2611330631170542,big,0.08,256,PRUNED
462,462,40.4589108,2023-05-18 16:37:52.866089,2023-05-18 16:39:08.613786,0 days 00:01:15.747697,2048,1000000,0.9,0.0011336294752562494,0,0.10625716013206693,big,0.08,256,PRUNED
463,463,46.118639200000004,2023-05-18 16:37:59.271566,2023-05-18 16:39:15.269905,0 days 00:01:15.998339,2048,1000000,0.9,0.002590449555363329,0,-0.11902517337950261,big,0.08,256,PRUNED
464,464,54.365806199999994,2023-05-18 16:38:07.514744,2023-05-18 16:38:08.367736,0 days 00:00:00.852992,1024,1000000,0.99,0.03292028588907827,1000,0.7609476358483495,big,0.08,8,PRUNED
465,465,78.6634912,2023-05-18 16:38:08.374465,2023-05-18 16:38:09.505605,0 days 00:00:01.131140,2048,1000000,0.98,2.0644230167732998e-05,1000,-0.664974481926201,big,0.08,128,PRUNED
466,466,114.5391012,2023-05-18 16:38:09.515486,2023-05-18 16:38:10.372219,0 days 00:00:00.856733,2048,1000000,0.9,5.631594045660733e-05,1000,-1.6833695928391017,big,0.08,512,PRUNED
467,467,172.67517500000002,2023-05-18 16:38:10.374429,2023-05-18 16:38:11.765779,0 days 00:00:01.391350,512,1000000,0.95,0.0006616878749306437,1000,-2.0175053045232483,big,0.08,32,COMPLETE
468,468,104.01387459999998,2023-05-18 16:38:11.767943,2023-05-18 16:38:12.477552,0 days 00:00:00.709609,2048,1000000,0.9,0.00013224964863289644,10000,0.5309667340772234,big,0.08,32,PRUNED
469,469,23.8888408,2023-05-18 16:38:12.478630,2023-05-18 16:38:51.183324,0 days 00:00:38.704694,2048,1000000,0.98,5.6498271440951645e-05,0,0.8920159589262782,small,0.08,1,PRUNED
470,470,109.05395180000001,2023-05-18 16:38:15.338987,2023-05-18 16:38:16.838840,0 days 00:00:01.499853,64,1000000,0.9,0.0009000156236192259,20000,-3.7224813401918024,big,0.08,1,PRUNED
471,471,12.983918200000002,2023-05-18 16:38:16.842903,2023-05-18 16:38:53.995338,0 days 00:00:37.152435,2048,1000000,0.98,0.00012416872091608277,0,0.6042885558732063,small,0.08,4,PRUNED
472,472,175.2723754,2023-05-18 16:38:51.185726,2023-05-18 16:39:27.680491,0 days 00:00:36.494765,128,10000,0.9,0.0016833188191961517,0,-1.8608269858917872,big,0.08,128,COMPLETE
473,473,167.77237340000002,2023-05-18 16:38:53.999750,2023-05-18 16:39:26.303727,0 days 00:00:32.303977,128,10000,0.95,0.0033774473823169724,0,-0.651283526222669,medium,0.08,64,PRUNED
474,474,18.107314799999997,2023-05-18 16:39:08.618256,2023-05-18 16:39:09.297761,0 days 00:00:00.679505,32,1000000,0.9999,0.5191688231447384,1000,-3.793516589342573,small,0.02,64,PRUNED
475,475,114.89337900000001,2023-05-18 16:39:09.298912,2023-05-18 16:39:43.169560,0 days 00:00:33.870648,128,1000000,0.95,0.00016128592844495365,0,-0.09284081853983611,big,0.001,64,PRUNED
476,476,64.7804348,2023-05-18 16:39:15.271115,2023-05-18 16:39:44.971533,0 days 00:00:29.700418,64,10000,0.9,0.0021294174544899992,0,-2.410895269640477,big,0.08,1,PRUNED
477,477,12.146999400000002,2023-05-18 16:39:26.304877,2023-05-18 16:41:16.708877,0 days 00:01:50.404000,2048,10000,0.95,0.0006895487154111523,0,-1.8905687972171261,big,0.08,128,PRUNED
478,478,45.778133000000004,2023-05-18 16:39:27.681893,2023-05-18 16:39:47.345041,0 days 00:00:19.663148,128,10000,0.95,0.001405619363384303,0,-1.1648682751237232,big,0.08,256,PRUNED
479,479,40.29296480000001,2023-05-18 16:39:43.171483,2023-05-18 16:40:22.896717,0 days 00:00:39.725234,128,10000,0.95,0.00013859660838145955,0,-0.7912808423729655,big,0.08,4,PRUNED
480,480,17.1475572,2023-05-18 16:39:44.973250,2023-05-18 16:40:12.178999,0 days 00:00:27.205749,64,10000,0.995,0.0011313188769803888,0,-1.883534415190827,big,0.08,64,PRUNED
