,number,value,datetime_start,datetime_complete,duration,params_batch_size,params_buffer_size,params_gamma,params_learning_rate,params_learning_starts,params_log_std_init,params_net_arch,params_tau,params_train_freq,state
359,359,16.30224,2023-05-18 14:42:36.021984,2023-05-18 14:42:37.488348,0 days 00:00:01.466364,16,1000000,0.98,4.6459762480777617e-05,1000,-1.0821313730139575,big,0.05,8,PRUNED
360,360,155.7194736,2023-05-18 14:42:37.490413,2023-05-18 14:42:42.998761,0 days 00:00:05.508348,32,100000,0.999,0.0013466052509861878,20000,-1.0669716708854953,big,0.08,256,PRUNED
361,361,21.289179400000002,2023-05-18 14:42:43.001284,2023-05-18 14:42:45.321748,0 days 00:00:02.320464,128,100000,0.999,9.105427165824072e-05,20000,-0.8367800017813198,big,0.01,1,PRUNED
362,362,15.135064199999999,2023-05-18 14:42:45.325620,2023-05-18 14:42:47.648591,0 days 00:00:02.322971,256,100000,0.9999,7.698848223656889e-05,1000,0.06893733004931535,medium,0.001,32,PRUNED
363,363,10.952887200000001,2023-05-18 14:42:47.649732,2023-05-18 14:42:49.720719,0 days 00:00:02.070987,32,100000,0.9999,0.0019597841844888222,20000,-1.4236285904053174,big,0.01,8,PRUNED
364,364,18.866597399999996,2023-05-18 14:42:49.332869,2023-05-18 14:42:51.304277,0 days 00:00:01.971408,32,100000,0.9,0.0010728049701206365,1000,0.6012222726315625,medium,0.001,256,PRUNED
365,365,24.1337996,2023-05-18 14:42:49.724396,2023-05-18 14:42:51.739878,0 days 00:00:02.015482,32,100000,0.999,7.401929565933357e-05,10000,-0.8079267540835456,big,0.01,64,PRUNED
366,366,98.2537966,2023-05-18 14:42:51.309252,2023-05-18 14:42:55.948391,0 days 00:00:04.639139,32,100000,0.9999,5.4647673513969667e-05,1000,0.5332609852195823,medium,0.08,1,PRUNED
367,367,9.403360000000001,2023-05-18 14:42:51.741086,2023-05-18 14:42:54.283691,0 days 00:00:02.542605,32,10000,0.9,0.0017549242266637975,1000,0.5128737950538105,big,0.005,512,PRUNED
368,368,12.014861,2023-05-18 14:42:54.286305,2023-05-18 14:42:55.892220,0 days 00:00:01.605915,32,10000,0.9,0.0012738638664418725,1000,0.15032179688661562,small,0.005,32,PRUNED
369,369,121.00254020000003,2023-05-18 14:42:55.893432,2023-05-18 14:43:00.534927,0 days 00:00:04.641495,512,100000,0.9999,3.3629248012995855e-05,1000,-0.9666888420323121,big,0.05,32,PRUNED
370,370,7.4079672,2023-05-18 14:42:55.973016,2023-05-18 14:42:58.720830,0 days 00:00:02.747814,32,100000,0.9,0.00039115139273710435,20000,-1.0438704384439275,big,0.01,64,PRUNED
371,371,18.687148399999998,2023-05-18 14:42:58.731751,2023-05-18 14:43:00.847978,0 days 00:00:02.116227,1024,100000,0.98,0.0029383960434460235,1000,0.10353696525289892,big,0.001,32,PRUNED
372,372,48.2397756,2023-05-18 14:43:00.542273,2023-05-18 14:43:05.066641,0 days 00:00:04.524368,32,100000,0.9,0.0001017202786343268,1000,0.36351258806624864,big,0.001,4,PRUNED
373,373,22.501710799999994,2023-05-18 14:43:00.849374,2023-05-18 14:43:02.880364,0 days 00:00:02.030990,32,100000,0.9,0.0009377363821165704,1000,0.47851007686331815,big,0.01,256,PRUNED
374,374,16.027415400000002,2023-05-18 14:43:02.883290,2023-05-18 14:43:04.719072,0 days 00:00:01.835782,512,10000,0.9,0.007658667993102556,1000,0.1736625223131507,big,0.005,32,PRUNED
375,375,79.2485674,2023-05-18 14:43:04.720962,2023-05-18 14:44:47.721245,0 days 00:01:43.000283,256,100000,0.9,0.0002113369656890737,0,-1.6430383411896732,big,0.02,8,PRUNED
376,376,19.634405199999996,2023-05-18 14:43:05.067737,2023-05-18 14:43:06.916180,0 days 00:00:01.848443,32,100000,0.9,0.0007127566289929928,1000,0.7889418663209227,small,0.01,64,PRUNED
377,377,21.718679,2023-05-18 14:43:06.918997,2023-05-18 14:43:08.946496,0 days 00:00:02.027499,1024,1000000,0.98,6.753160925369718e-05,1000,-0.8191060581836589,big,0.05,4,PRUNED
378,378,58.263983599999996,2023-05-18 14:43:08.950812,2023-05-18 14:43:11.311074,0 days 00:00:02.360262,32,100000,0.99,0.0013076275970602162,10000,0.41397420126436973,big,0.01,64,PRUNED
379,379,30.1514296,2023-05-18 14:43:11.319088,2023-05-18 14:43:13.297246,0 days 00:00:01.978158,32,100000,0.9999,0.00010187305060461816,1000,0.4374869733207881,medium,0.01,16,PRUNED
380,380,31.857338200000004,2023-05-18 14:43:13.298732,2023-05-18 14:43:15.401842,0 days 00:00:02.103110,32,10000,0.99,0.00016774085444562018,1000,0.09101799533386234,big,0.005,32,PRUNED
381,381,38.075611800000004,2023-05-18 14:43:15.403963,2023-05-18 14:44:22.699532,0 days 00:01:07.295569,32,100000,0.999,0.009472029077818222,0,-0.003766747545599969,big,0.01,64,PRUNED
382,382,17.4490162,2023-05-18 14:43:27.068039,2023-05-18 14:43:29.488365,0 days 00:00:02.420326,32,10000,0.999,0.0001861740935915289,20000,-1.2153843988247532,big,0.01,64,PRUNED
383,383,12.317083400000001,2023-05-18 14:43:29.490346,2023-05-18 14:43:31.014451,0 days 00:00:01.524105,32,100000,0.98,0.000548463962851716,20000,-0.19255860703579308,big,0.01,64,PRUNED
384,384,40.4111592,2023-05-18 14:43:29.558336,2023-05-18 14:46:14.769112,0 days 00:02:45.210776,1024,100000,0.98,0.0002850233106078603,0,-1.161816651088816,big,0.05,32,PRUNED
385,385,12.5475156,2023-05-18 14:43:31.015889,2023-05-18 14:43:32.895091,0 days 00:00:01.879202,1024,1000000,0.98,4.0031796954288915e-05,1000,0.1630451006445761,big,0.001,16,PRUNED
386,386,17.9257852,2023-05-18 14:43:32.901576,2023-05-18 14:43:34.856007,0 days 00:00:01.954431,32,100000,0.9,0.0001526052008909798,1000,-0.3791017838768046,medium,0.001,32,PRUNED
387,387,20.795879,2023-05-18 14:43:34.857366,2023-05-18 14:46:21.612660,0 days 00:02:46.755294,1024,100000,0.98,5.35944715188296e-05,0,0.4043771527768879,big,0.02,32,PRUNED
388,388,20.866391399999998,2023-05-18 14:43:38.902213,2023-05-18 14:46:24.252983,0 days 00:02:45.350770,1024,100000,0.98,3.1384794171871145e-05,0,-0.49016182962833427,big,0.05,32,PRUNED
389,389,91.441946,2023-05-18 14:43:40.454896,2023-05-18 14:43:46.940103,0 days 00:00:06.485207,1024,10000,0.999,0.0337383765101563,1000,-1.2121235595443023,big,0.005,16,PRUNED
390,390,198.9386528,2023-05-18 14:43:42.328128,2023-05-18 14:43:52.083808,0 days 00:00:09.755680,2048,10000,0.9999,0.00023343819313670385,1000,0.872518436301075,medium,0.001,16,COMPLETE
391,391,74.4827804,2023-05-18 14:43:46.943934,2023-05-18 14:45:18.767359,0 days 00:01:31.823425,256,100000,0.9,3.0533674638806185e-05,0,-2.805986643593134,big,0.02,64,PRUNED
392,392,23.717406,2023-05-18 14:43:52.089586,2023-05-18 14:43:57.289982,0 days 00:00:05.200396,256,100000,0.98,0.0012721617844899816,0,-1.195510020516855,big,0.02,512,PRUNED
393,393,17.2630498,2023-05-18 14:43:57.295144,2023-05-18 14:43:59.335313,0 days 00:00:02.040169,2048,10000,0.995,0.0005134392999168845,1000,0.7784687393749492,medium,0.001,16,PRUNED
394,394,29.593798800000002,2023-05-18 14:43:59.339105,2023-05-18 14:44:01.605649,0 days 00:00:02.266544,128,10000,0.9999,0.0010211106326772623,1000,-0.0642230364174099,medium,0.001,16,PRUNED
395,395,23.1314608,2023-05-18 14:44:01.608168,2023-05-18 14:44:03.575159,0 days 00:00:01.966991,2048,1000000,0.9999,2.4112606808152027e-05,1000,0.512801993910488,medium,0.001,512,PRUNED
396,396,-0.8795218,2023-05-18 14:44:03.576511,2023-05-18 14:46:48.523109,0 days 00:02:44.946598,1024,100000,0.98,7.380582306595642e-05,0,0.1607097414445698,big,0.05,32,PRUNED
397,397,268.49263579999996,2023-05-18 14:44:16.177939,2023-05-18 14:47:26.126241,0 days 00:03:09.948302,1024,100000,0.95,0.00034247030695463217,0,-0.15228503973557234,big,0.05,32,COMPLETE
398,398,49.5679272,2023-05-18 14:44:22.706372,2023-05-18 14:48:46.874172,0 days 00:04:24.167800,2048,100000,0.98,0.0012341327196292297,0,0.2335896543989898,big,0.05,32,PRUNED
399,399,29.4621704,2023-05-18 14:44:47.722707,2023-05-18 14:44:51.553773,0 days 00:00:03.831066,1024,1000000,0.98,9.46248282886158e-05,1000,-0.8932124097933253,big,0.08,1,PRUNED
400,400,78.70598319999999,2023-05-18 14:44:51.557012,2023-05-18 14:44:54.213286,0 days 00:00:02.656274,2048,10000,0.9999,1.7085266923641647e-05,1000,0.4572169131119283,medium,0.001,16,PRUNED
401,401,27.0393764,2023-05-18 14:44:54.216651,2023-05-18 14:47:43.184561,0 days 00:02:48.967910,1024,100000,0.9,0.00017849576777802272,0,0.27468797914369686,big,0.05,32,PRUNED
402,402,162.1693536,2023-05-18 14:45:18.768165,2023-05-18 14:47:23.676558,0 days 00:02:04.908393,512,100000,0.98,0.00014639756087716008,0,0.6946502729132957,big,0.05,32,PRUNED
403,403,18.173230999999998,2023-05-18 14:46:14.780057,2023-05-18 14:47:19.262365,0 days 00:01:04.482308,32,100000,0.95,3.450667734618839e-05,0,0.6998063922267951,big,0.05,32,PRUNED
404,404,10.1541106,2023-05-18 14:46:21.615600,2023-05-18 14:46:23.472152,0 days 00:00:01.856552,1024,1000000,0.98,7.843019058095193e-05,1000,0.2951677448158454,small,0.05,8,PRUNED
405,405,8.202569,2023-05-18 14:46:23.475038,2023-05-18 14:49:08.493326,0 days 00:02:45.018288,1024,1000000,0.98,3.1633985597798335e-05,0,0.08817799226346451,big,0.05,32,PRUNED
406,406,50.681299599999996,2023-05-18 14:46:24.256432,2023-05-18 14:49:15.968638,0 days 00:02:51.712206,1024,1000000,0.98,0.00010569423204744,0,0.10380121530465808,big,0.05,8,PRUNED
407,407,10.118747,2023-05-18 14:46:48.532169,2023-05-18 14:46:51.184354,0 days 00:00:02.652185,32,1000000,0.9,0.0008033858174451032,1000,-0.2692250155054933,big,0.005,32,PRUNED
408,408,21.606339400000003,2023-05-18 14:46:51.188166,2023-05-18 14:46:52.940895,0 days 00:00:01.752729,1024,100000,0.98,0.00010951396451089115,1000,-0.43277087426674876,small,0.01,32,PRUNED
409,409,13.4241894,2023-05-18 14:46:52.942936,2023-05-18 14:46:54.626634,0 days 00:00:01.683698,32,100000,0.95,4.9374780324524206e-05,20000,0.7499170357847385,medium,0.02,64,PRUNED
410,410,22.078984999999996,2023-05-18 14:46:54.628266,2023-05-18 14:46:56.799619,0 days 00:00:02.171353,32,100000,0.999,5.299871947727174e-05,20000,-1.5687582645543152,medium,0.01,64,PRUNED
411,411,46.379081199999995,2023-05-18 14:46:56.812246,2023-05-18 14:46:59.627184,0 days 00:00:02.814938,32,100000,0.95,0.004902705361406344,20000,0.806397721558054,big,0.01,32,PRUNED
412,412,200.37829539999998,2023-05-18 14:46:59.629496,2023-05-18 14:51:40.862290,0 days 00:04:41.232794,2048,100000,0.98,0.001994332567290241,0,0.6251069500175156,big,0.05,32,COMPLETE
413,413,38.119839999999996,2023-05-18 14:47:19.264772,2023-05-18 14:47:23.598540,0 days 00:00:04.333768,32,100000,0.99,0.0010019828951557917,20000,0.25364361425049436,big,0.02,4,PRUNED
414,414,13.2044218,2023-05-18 14:47:23.599551,2023-05-18 14:47:26.068988,0 days 00:00:02.469437,32,100000,0.98,0.00035777806123865987,1000,0.7352306630255692,big,0.01,64,PRUNED
415,415,37.2516138,2023-05-18 14:47:23.683291,2023-05-18 14:47:27.282704,0 days 00:00:03.599413,2048,10000,0.9999,0.003907282869473184,1000,0.6552916277341297,medium,0.001,16,PRUNED
416,416,36.6384138,2023-05-18 14:47:26.070028,2023-05-18 14:47:29.024425,0 days 00:00:02.954397,2048,10000,0.9999,0.002895292464418554,1000,0.5210536362240058,medium,0.001,16,PRUNED
417,417,-0.05980040000000002,2023-05-18 14:47:26.129485,2023-05-18 14:50:10.705185,0 days 00:02:44.575700,1024,100000,0.95,7.703808856762322e-05,0,0.6493229940371381,big,0.08,32,PRUNED
418,418,13.1814178,2023-05-18 14:47:27.291039,2023-05-18 14:47:29.816077,0 days 00:00:02.525038,16,1000000,0.9999,0.0003458331422783955,1000,0.8175549199565396,medium,0.001,16,PRUNED
419,419,47.754036799999994,2023-05-18 14:47:29.027706,2023-05-18 14:50:15.234943,0 days 00:02:46.207237,1024,100000,0.95,0.0001442475661091703,0,-0.5483042868539196,big,0.05,32,PRUNED
420,420,-2.1355168,2023-05-18 14:47:29.821965,2023-05-18 14:49:44.441604,0 days 00:02:14.619639,1024,100000,0.9999,0.00010843159811739905,0,-0.00304911781767378,medium,0.05,32,PRUNED
421,421,38.099170400000006,2023-05-18 14:47:43.187784,2023-05-18 14:47:45.375887,0 days 00:00:02.188103,2048,1000000,0.9999,5.552343059291812e-05,1000,-0.09416789256127611,medium,0.01,32,PRUNED
422,422,149.45498719999998,2023-05-18 14:47:45.380105,2023-05-18 14:50:18.769541,0 days 00:02:33.389436,1024,100000,0.95,0.0010803285451208948,0,-0.2584228413300792,big,0.05,64,PRUNED
423,423,24.286403200000002,2023-05-18 14:48:46.898219,2023-05-18 14:48:49.166594,0 days 00:00:02.268375,128,100000,0.95,1.3134078750769347e-05,20000,0.15730326876263134,big,0.02,64,PRUNED
424,424,128.3957616,2023-05-18 14:48:49.171065,2023-05-18 14:48:53.717851,0 days 00:00:04.546786,1024,100000,0.9,0.0008433978318861474,1000,0.76290221457051,big,0.01,64,PRUNED
425,425,40.4468024,2023-05-18 14:48:53.723395,2023-05-18 14:51:40.281490,0 days 00:02:46.558095,1024,100000,0.95,0.00010253869659636826,0,-0.8922696259768264,big,0.05,32,PRUNED
426,426,18.680608,2023-05-18 14:49:08.503033,2023-05-18 14:49:10.797251,0 days 00:00:02.294218,16,100000,0.9,3.986213904569004e-05,1000,0.7228345429297779,big,0.001,32,PRUNED
427,427,115.1117076,2023-05-18 14:49:10.819378,2023-05-18 14:51:55.434392,0 days 00:02:44.615014,1024,100000,0.95,0.001694432428675546,0,-0.5572124697233574,big,0.05,32,PRUNED
428,428,237.36677259999996,2023-05-18 14:49:15.972587,2023-05-18 14:52:10.257865,0 days 00:02:54.285278,1024,100000,0.95,0.0004298910504983352,0,-0.5262617286763418,big,0.05,32,COMPLETE
429,429,108.40737220000001,2023-05-18 14:49:44.447526,2023-05-18 14:52:26.444376,0 days 00:02:41.996850,1024,100000,0.95,3.839799426476376e-05,0,-1.4261634227636557,big,0.05,32,PRUNED
430,430,118.071838,2023-05-18 14:50:10.706085,2023-05-18 14:52:45.888584,0 days 00:02:35.182499,1024,100000,0.95,0.0013510970509033637,0,0.7538731512961461,big,0.001,32,PRUNED
431,431,29.059814999999997,2023-05-18 14:50:15.236650,2023-05-18 14:50:18.974038,0 days 00:00:03.737388,2048,100000,0.9999,1.8512368565487644e-05,10000,-0.5431716839327044,medium,0.001,32,PRUNED
432,432,39.108567199999996,2023-05-18 14:50:18.770864,2023-05-18 14:50:21.354441,0 days 00:00:02.583577,2048,100000,0.99,0.00027801662026630963,1000,0.8966261555591487,medium,0.001,32,PRUNED
433,433,185.518857,2023-05-18 14:50:18.976723,2023-05-18 14:51:26.096041,0 days 00:01:07.119318,1024,100000,0.95,0.003173262975349958,0,0.04009237821245734,small,0.05,32,COMPLETE
434,434,27.0435618,2023-05-18 14:50:21.357016,2023-05-18 14:50:24.165334,0 days 00:00:02.808318,32,100000,0.9999,6.654593987935855e-05,1000,0.24090289003668286,big,0.001,32,PRUNED
435,435,21.801827600000003,2023-05-18 14:50:24.172036,2023-05-18 14:50:26.437282,0 days 00:00:02.265246,2048,100000,0.9999,0.00027243955511436325,1000,0.915158549340469,big,0.001,16,PRUNED
436,436,51.82682719999999,2023-05-18 14:50:26.438783,2023-05-18 14:50:30.024124,0 days 00:00:03.585341,32,100000,0.999,0.006659549060835929,20000,0.7176747455859881,big,0.02,64,PRUNED
437,437,131.3419622,2023-05-18 14:50:30.025495,2023-05-18 14:50:37.648179,0 days 00:00:07.622684,16,100000,0.95,0.0009723616352372695,20000,-0.40936636639423213,big,0.01,64,PRUNED
438,438,56.4341252,2023-05-18 14:50:37.656507,2023-05-18 14:52:11.116312,0 days 00:01:33.459805,256,100000,0.999,2.7514147379930364e-05,0,0.8021222158424022,big,0.001,32,PRUNED
439,439,22.415425000000003,2023-05-18 14:51:26.102818,2023-05-18 14:51:28.972845,0 days 00:00:02.870027,2048,100000,0.999,3.469183008008282e-05,1000,-0.7735799019273041,medium,0.001,32,PRUNED
440,440,40.881624800000004,2023-05-18 14:51:28.976685,2023-05-18 14:52:32.077769,0 days 00:01:03.101084,1024,100000,0.95,0.00041934922286924347,0,-0.07549583013453649,small,0.05,32,PRUNED
441,441,242.864198,2023-05-18 14:51:40.284977,2023-05-18 14:58:47.926638,0 days 00:07:07.641661,256,1000000,0.95,0.0017676208115169928,0,-0.03245524357868945,big,0.02,64,COMPLETE
442,442,543.7858238,2023-05-18 14:51:40.863738,2023-05-18 14:58:30.553624,0 days 00:06:49.689886,1024,1000000,0.95,0.009010684537403895,0,0.5963803082839476,small,0.05,32,COMPLETE
443,443,183.6416296,2023-05-18 14:51:55.436097,2023-05-18 14:58:36.635541,0 days 00:06:41.199444,1024,100000,0.95,0.0013345286805461097,0,0.2614417821048672,small,0.05,32,COMPLETE
444,444,32.6665638,2023-05-18 14:52:10.262722,2023-05-18 14:58:50.218073,0 days 00:06:39.955351,1024,100000,0.95,4.859488728398093e-05,0,-0.7552290600734436,small,0.05,4,PRUNED
445,445,67.087554,2023-05-18 14:52:11.126489,2023-05-18 14:58:47.115408,0 days 00:06:35.988919,1024,100000,0.95,0.002796728067574915,0,-0.2199838998367383,small,0.05,32,PRUNED
446,446,125.1470086,2023-05-18 14:52:26.456402,2023-05-18 14:58:59.012241,0 days 00:06:32.555839,512,100000,0.95,0.0020262848148764763,0,-0.32831058746837916,small,0.05,32,PRUNED
447,447,19.1417432,2023-05-18 14:52:32.079326,2023-05-18 14:52:34.012042,0 days 00:00:01.932716,2048,100000,0.9999,6.82059131956003e-05,1000,0.5106549888070834,medium,0.005,32,PRUNED
448,448,13.739466199999999,2023-05-18 14:52:34.013487,2023-05-18 14:52:35.659732,0 days 00:00:01.646245,1024,100000,0.95,0.06400863026111803,20000,0.4847958325446279,small,0.05,32,PRUNED
449,449,112.75251060000001,2023-05-18 14:52:35.661650,2023-05-18 14:52:39.542384,0 days 00:00:03.880734,32,1000000,0.98,0.00022186317060419534,1000,-0.9356477314000146,big,0.05,16,PRUNED
450,450,22.5819028,2023-05-18 14:52:39.548453,2023-05-18 14:52:41.572489,0 days 00:00:02.024036,32,100000,0.999,0.0007327057257824149,20000,-1.0694208529217777,big,0.01,16,PRUNED
451,451,109.8781242,2023-05-18 14:52:41.576425,2023-05-18 15:00:27.283570,0 days 00:07:45.707145,1024,100000,0.98,0.00038169985122983347,0,0.37703207661403615,big,0.001,4,PRUNED
452,452,156.5153402,2023-05-18 14:52:45.890289,2023-05-18 14:59:33.218190,0 days 00:06:47.327901,2048,100000,0.98,0.04329439167357118,0,-0.6316678822645997,small,0.05,32,PRUNED
453,453,12.135746,2023-05-18 14:58:30.556986,2023-05-18 14:58:33.067402,0 days 00:00:02.510416,32,100000,0.999,0.0009516131786690909,20000,-0.34703290746849774,big,0.01,32,PRUNED
454,454,161.04965020000003,2023-05-18 14:58:33.071342,2023-05-18 14:59:46.250060,0 days 00:01:13.178718,1024,100000,0.95,0.03129415748833001,0,0.6488814294027271,small,0.05,1,PRUNED
455,455,53.161852999999994,2023-05-18 14:58:36.641225,2023-05-18 14:59:24.910431,0 days 00:00:48.269206,16,100000,0.95,0.001327772022767672,0,0.5265075595595604,small,0.05,32,PRUNED
456,456,78.1126888,2023-05-18 14:58:47.116586,2023-05-18 14:59:57.043260,0 days 00:01:09.926674,1024,1000000,0.95,0.0020083788165439122,0,0.15563901163865235,small,0.05,32,PRUNED
457,457,18.262013200000002,2023-05-18 14:58:47.928083,2023-05-18 14:58:49.907024,0 days 00:00:01.978941,64,100000,0.98,0.0004617091677322467,10000,0.8574346843893659,big,0.05,32,PRUNED
458,458,44.24148799999999,2023-05-18 14:58:49.908418,2023-05-18 14:59:58.053606,0 days 00:01:08.145188,1024,1000000,0.95,0.1843770113947303,0,-0.6382824538164913,small,0.05,32,PRUNED
459,459,130.7561072,2023-05-18 14:58:50.221881,2023-05-18 14:59:59.826627,0 days 00:01:09.604746,1024,1000000,0.95,0.04935440350892771,0,0.6828693081873439,small,0.05,32,PRUNED
460,460,15.790867400000002,2023-05-18 14:58:59.016484,2023-05-18 15:00:19.998712,0 days 00:01:20.982228,128,1000000,0.999,2.0058957753267658e-05,0,0.09623064363849798,big,0.05,32,PRUNED
461,461,41.9070272,2023-05-18 14:59:24.914564,2023-05-18 15:01:45.950465,0 days 00:02:21.035901,1024,100000,0.98,0.0025135602749335193,0,0.596188309777995,big,0.01,32,PRUNED
462,462,112.81493759999998,2023-05-18 14:59:33.219890,2023-05-18 15:01:01.901943,0 days 00:01:28.682053,256,1000000,0.95,0.0016170873117486333,0,0.12913634469243446,big,0.02,64,PRUNED
463,463,10.468919199999998,2023-05-18 14:59:46.251111,2023-05-18 14:59:48.632750,0 days 00:00:02.381639,32,100000,0.95,0.006265793763288381,20000,0.15832836571716963,small,0.01,64,PRUNED
464,464,38.3496652,2023-05-18 14:59:48.635714,2023-05-18 15:01:03.139319,0 days 00:01:14.503605,64,100000,0.995,1.8417536761090436e-05,0,0.921660546289034,big,0.05,32,PRUNED
465,465,157.872564,2023-05-18 14:59:57.050107,2023-05-18 15:00:57.039523,0 days 00:00:59.989416,512,1000000,0.95,0.051569697965001195,0,0.9731970083784477,small,0.05,32,PRUNED
466,466,4.155973,2023-05-18 14:59:58.054939,2023-05-18 15:01:25.028388,0 days 00:01:26.973449,256,1000000,0.95,0.11844639394403515,0,-1.2917008692580554,big,0.02,64,PRUNED
467,467,41.578344400000006,2023-05-18 14:59:59.834417,2023-05-18 15:01:09.850930,0 days 00:01:10.016513,32,100000,0.98,0.0020057477220807095,0,0.13474012424949833,big,0.01,32,PRUNED
468,468,145.2004716,2023-05-18 15:00:20.000117,2023-05-18 15:01:54.208040,0 days 00:01:34.207923,256,1000000,0.95,0.00029658605407771734,0,-0.00045216520765161555,big,0.02,64,PRUNED
469,469,28.638717599999996,2023-05-18 15:00:27.286868,2023-05-18 15:00:29.184181,0 days 00:00:01.897313,32,100000,0.9,0.0013827226562662398,1000,-0.5051307677829966,medium,0.01,64,PRUNED
470,470,138.979808,2023-05-18 15:00:29.186422,2023-05-18 15:00:35.240785,0 days 00:00:06.054363,64,100000,0.9999,9.334514148215162e-05,1000,0.20925963793523683,medium,0.001,32,PRUNED
471,471,43.862713,2023-05-18 15:00:35.246235,2023-05-18 15:01:42.109127,0 days 00:01:06.862892,32,1000000,0.95,0.0029888210054367444,0,-0.7095064227053279,big,0.02,64,PRUNED
472,472,89.663714,2023-05-18 15:00:57.043109,2023-05-18 15:01:00.153803,0 days 00:00:03.110694,256,1000000,0.95,0.0003579138525449172,1000,0.9503830352663049,big,0.02,64,PRUNED
473,473,167.3890118,2023-05-18 15:01:00.155486,2023-05-18 15:02:22.449831,0 days 00:01:22.294345,256,1000000,0.95,0.03770374974728191,0,-0.9333842866913313,big,0.02,128,PRUNED
474,474,33.0782478,2023-05-18 15:01:01.904559,2023-05-18 15:01:04.901413,0 days 00:00:02.996854,1024,1000000,0.98,2.4426409086387276e-05,10000,-1.9183208636621984,big,0.05,32,PRUNED
475,475,22.3460152,2023-05-18 15:01:03.140520,2023-05-18 15:01:05.533948,0 days 00:00:02.393428,512,1000000,0.99,7.723685548004484e-05,1000,-0.4155041642302373,big,0.05,32,PRUNED
476,476,28.8021142,2023-05-18 15:01:04.902983,2023-05-18 15:01:07.406514,0 days 00:00:02.503531,2048,100000,0.98,0.19198382028885558,10000,0.8834778941865518,big,0.05,32,PRUNED
477,477,62.990721799999996,2023-05-18 15:01:05.535438,2023-05-18 15:01:08.641937,0 days 00:00:03.106499,1024,1000000,0.9999,1.591389633976596e-05,1000,0.9767534342634855,medium,0.001,32,PRUNED
