,number,value,datetime_start,datetime_complete,duration,params_batch_size,params_buffer_size,params_gamma,params_learning_rate,params_learning_starts,params_log_std_init,params_net_arch,params_tau,params_train_freq,state
240,240,51.62335700000001,2023-05-18 14:40:07.365747,2023-05-18 14:40:10.224320,0 days 00:00:02.858573,32,100000,0.9999,3.325460509031669e-05,20000,0.7015617438997027,big,0.02,32,PRUNED
241,241,23.965277599999997,2023-05-18 14:40:08.673655,2023-05-18 14:40:12.208826,0 days 00:00:03.535171,32,100000,0.999,1.2495516475883696e-05,1000,0.48850213247617,big,0.08,128,PRUNED
242,242,16.927767999999997,2023-05-18 14:40:09.266522,2023-05-18 14:40:11.369330,0 days 00:00:02.102808,512,100000,0.9,7.846481060844388e-05,1000,0.698814898572272,big,0.08,32,PRUNED
243,243,30.4819568,2023-05-18 14:40:10.227416,2023-05-18 14:40:12.918664,0 days 00:00:02.691248,128,100000,0.999,1.2464675453469943e-05,1000,-0.22736379724870381,big,0.005,128,PRUNED
244,244,13.335690599999998,2023-05-18 14:40:11.371226,2023-05-18 14:40:12.901308,0 days 00:00:01.530082,32,100000,0.999,0.00010340322707865442,1000,0.4447387404864405,medium,0.005,128,PRUNED
245,245,19.3148618,2023-05-18 14:40:12.210665,2023-05-18 14:40:14.318893,0 days 00:00:02.108228,32,100000,0.98,8.63083631408362e-05,1000,0.13346938566592154,big,0.005,4,PRUNED
246,246,215.3315916,2023-05-18 14:40:12.903658,2023-05-18 14:40:17.085427,0 days 00:00:04.181769,32,100000,0.9,0.0010091864225952646,1000,0.3309750355576049,big,0.01,64,COMPLETE
247,247,48.1414872,2023-05-18 14:40:12.919820,2023-05-18 14:41:21.915928,0 days 00:01:08.996108,32,100000,0.9999,3.0293106108811275e-05,0,0.03679004906386696,big,0.005,128,PRUNED
248,248,87.18446639999999,2023-05-18 14:40:14.319951,2023-05-18 14:40:16.687966,0 days 00:00:02.368015,32,100000,0.9999,1.7969521297885708e-05,1000,0.7503712411538311,small,0.02,32,PRUNED
249,249,26.9757494,2023-05-18 14:40:16.689296,2023-05-18 14:40:18.782848,0 days 00:00:02.093552,64,10000,0.999,0.11044856301593055,1000,-0.6870779815786658,big,0.005,64,PRUNED
250,250,17.5061538,2023-05-18 14:40:17.087082,2023-05-18 14:40:19.455939,0 days 00:00:02.368857,32,100000,0.999,2.0969221298395914e-05,10000,0.48916809157392027,big,0.005,128,PRUNED
251,251,92.74523360000002,2023-05-18 14:40:18.787512,2023-05-18 14:40:22.511739,0 days 00:00:03.724227,64,100000,0.99,1.1244897025849121e-05,20000,0.8619065207796074,big,0.01,512,PRUNED
252,252,70.093408,2023-05-18 14:40:19.458944,2023-05-18 14:40:21.410976,0 days 00:00:01.952032,2048,100000,0.9,0.007965313911907206,1000,0.27030160226512634,big,0.01,64,PRUNED
253,253,11.911994799999999,2023-05-18 14:40:21.412693,2023-05-18 14:40:23.466015,0 days 00:00:02.053322,32,100000,0.9,0.016037519492209888,1000,0.1741503948965355,big,0.01,64,PRUNED
254,254,46.19011340000001,2023-05-18 14:40:22.515516,2023-05-18 14:40:26.574621,0 days 00:00:04.059105,32,100000,0.995,1.7385708112635108e-05,1000,0.2171211406713499,big,0.001,128,PRUNED
255,255,122.786729,2023-05-18 14:40:23.467085,2023-05-18 14:40:28.388568,0 days 00:00:04.921483,2048,100000,0.9999,0.0013420392084738484,1000,-1.5126099532450388,medium,0.001,32,PRUNED
256,256,96.98842319999999,2023-05-18 14:40:24.299748,2023-05-18 14:40:28.051605,0 days 00:00:03.751857,512,100000,0.98,0.0009544604542764596,1000,0.2638849301608157,big,0.05,32,PRUNED
257,257,32.9167602,2023-05-18 14:40:26.575686,2023-05-18 14:40:30.170586,0 days 00:00:03.594900,128,10000,0.98,0.1740795531188764,10000,-3.4557838135101187,big,0.005,16,PRUNED
258,258,33.023990600000005,2023-05-18 14:40:28.053457,2023-05-18 14:40:30.274138,0 days 00:00:02.220681,32,100000,0.9,9.483633535114392e-05,1000,-0.3552484252234889,big,0.01,64,PRUNED
259,259,47.937859599999996,2023-05-18 14:40:28.390624,2023-05-18 14:40:31.705195,0 days 00:00:03.314571,32,100000,0.9,1.5747694511748967e-05,1000,0.5507338408645596,big,0.01,64,PRUNED
260,260,50.004330800000005,2023-05-18 14:40:30.174750,2023-05-18 14:41:49.078098,0 days 00:01:18.903348,16,100000,0.95,0.0022488369551696237,0,0.6432156900196325,big,0.02,64,PRUNED
261,261,14.870511400000002,2023-05-18 14:40:30.275758,2023-05-18 14:40:32.211148,0 days 00:00:01.935390,1024,100000,0.98,6.742177188492229e-05,20000,-0.02161355033637677,medium,0.05,32,PRUNED
262,262,20.023929000000003,2023-05-18 14:40:31.707174,2023-05-18 14:40:34.010615,0 days 00:00:02.303441,512,100000,0.99,0.0015537301391244734,1000,0.20873914672661653,big,0.05,4,PRUNED
263,263,11.8362306,2023-05-18 14:40:32.216184,2023-05-18 14:40:34.515535,0 days 00:00:02.299351,32,100000,0.999,6.036284200323456e-05,1000,0.26602400879311944,big,0.005,8,PRUNED
264,264,34.26199140000001,2023-05-18 14:40:34.011702,2023-05-18 14:40:36.056523,0 days 00:00:02.044821,32,100000,0.999,1.7643099094614808e-05,1000,0.6459199207353424,big,0.005,128,PRUNED
265,265,142.7902772,2023-05-18 14:40:34.517589,2023-05-18 14:40:38.249061,0 days 00:00:03.731472,32,100000,0.999,1.1933173412169369e-05,1000,0.02907335966042257,big,0.005,128,PRUNED
266,266,116.5101306,2023-05-18 14:40:36.057501,2023-05-18 14:40:39.510732,0 days 00:00:03.453231,512,100000,0.99,2.0208041681153392e-05,1000,-0.7418633563123235,big,0.001,32,PRUNED
267,267,59.564736,2023-05-18 14:40:38.250484,2023-05-18 14:40:41.118999,0 days 00:00:02.868515,128,10000,0.99,0.0019399878518918169,1000,-1.5691033823483347,big,0.005,16,PRUNED
268,268,26.0470834,2023-05-18 14:40:39.515441,2023-05-18 14:40:41.352248,0 days 00:00:01.836807,2048,10000,0.9,0.00019038337498100154,1000,0.9937511140706596,big,0.01,32,PRUNED
269,269,21.7946122,2023-05-18 14:40:41.120094,2023-05-18 14:40:43.762846,0 days 00:00:02.642752,1024,1000000,0.98,0.0014264535844108724,1000,-1.6456874657680052,big,0.05,8,PRUNED
270,270,18.402308599999998,2023-05-18 14:40:41.354083,2023-05-18 14:40:43.113578,0 days 00:00:01.759495,256,100000,0.95,0.002825077009943186,20000,-0.0768096661712604,big,0.02,64,PRUNED
271,271,163.67072779999998,2023-05-18 14:40:43.115005,2023-05-18 14:40:47.338679,0 days 00:00:04.223674,1024,1000000,0.995,6.175265337408936e-05,1000,-0.9950289569441098,big,0.05,64,COMPLETE
272,272,198.95109639999998,2023-05-18 14:40:43.766304,2023-05-18 14:43:29.556543,0 days 00:02:45.790239,1024,100000,0.98,0.00018897256938690517,0,0.3551013618972971,big,0.05,32,COMPLETE
273,273,12.916581400000002,2023-05-18 14:40:47.340272,2023-05-18 14:40:49.066139,0 days 00:00:01.725867,2048,1000000,0.995,1.0787185320852731e-05,1000,-0.5228518586671146,big,0.05,64,PRUNED
274,274,27.380143399999998,2023-05-18 14:40:49.067527,2023-05-18 14:40:51.875614,0 days 00:00:02.808087,1024,1000000,0.995,7.844800615745491e-05,10000,0.40320308643554337,big,0.05,64,PRUNED
275,275,159.5421776,2023-05-18 14:40:50.014020,2023-05-18 14:40:54.126589,0 days 00:00:04.112569,1024,100000,0.98,0.0007041220911484579,1000,0.9269529548810767,big,0.05,32,COMPLETE
276,276,27.451449200000003,2023-05-18 14:40:51.877093,2023-05-18 14:40:54.371317,0 days 00:00:02.494224,1024,1000000,0.995,0.00016843918930113406,1000,-0.8140321365846453,big,0.08,64,PRUNED
277,277,37.5284286,2023-05-18 14:40:54.128985,2023-05-18 14:40:57.350003,0 days 00:00:03.221018,1024,1000000,0.995,2.8539098377919498e-05,1000,-0.7467466292414359,big,0.02,8,PRUNED
278,278,21.977445000000003,2023-05-18 14:40:54.375870,2023-05-18 14:40:56.457946,0 days 00:00:02.082076,1024,1000000,0.995,4.2724613387010034e-05,1000,-0.82691380630048,big,0.001,8,PRUNED
279,279,204.77762940000002,2023-05-18 14:40:56.460235,2023-05-18 14:41:04.210363,0 days 00:00:07.750128,1024,100000,0.98,0.00017878630775347747,1000,0.18642765552157636,big,0.001,32,COMPLETE
280,280,22.8218344,2023-05-18 14:40:57.351683,2023-05-18 14:41:00.195957,0 days 00:00:02.844274,1024,1000000,0.98,0.0007358957028684505,1000,0.040876546837910976,big,0.005,32,PRUNED
281,281,15.1419792,2023-05-18 14:41:00.196965,2023-05-18 14:41:02.139446,0 days 00:00:01.942481,1024,1000000,0.995,0.0002941896577672287,1000,-1.079334934860337,big,0.05,128,PRUNED
282,282,19.3091132,2023-05-18 14:41:01.162175,2023-05-18 14:41:03.385567,0 days 00:00:02.223392,1024,1000000,0.995,5.880589754709865e-05,1000,-1.2768006568657688,big,0.05,64,PRUNED
283,283,18.449219,2023-05-18 14:41:02.141944,2023-05-18 14:41:04.251893,0 days 00:00:02.109949,1024,100000,0.98,0.010696216756655915,1000,0.363259751181386,big,0.05,32,PRUNED
284,284,51.7963932,2023-05-18 14:41:03.387969,2023-05-18 14:42:26.623829,0 days 00:01:23.235860,256,100000,0.9,0.000841033917954164,0,-0.3655769765608905,small,0.02,8,PRUNED
285,285,76.562257,2023-05-18 14:41:04.212261,2023-05-18 14:41:09.100054,0 days 00:00:04.887793,1024,100000,0.98,0.006380004820274013,1000,0.28349239058065434,big,0.05,32,PRUNED
286,286,19.0459956,2023-05-18 14:41:04.258247,2023-05-18 14:41:06.506580,0 days 00:00:02.248333,32,100000,0.95,0.0014852892518742616,20000,0.08439897498678539,big,0.02,128,PRUNED
287,287,135.4355736,2023-05-18 14:41:06.507603,2023-05-18 14:42:49.331687,0 days 00:01:42.824084,128,100000,0.9999,0.0022760145779313454,0,0.960436500955411,big,0.02,64,PRUNED
288,288,12.334632799999998,2023-05-18 14:41:09.101496,2023-05-18 14:41:10.527985,0 days 00:00:01.426489,1024,100000,0.98,2.9156089821851468e-05,1000,0.22221723477610908,big,0.001,32,PRUNED
289,289,23.8708754,2023-05-18 14:41:10.529098,2023-05-18 14:41:12.411543,0 days 00:00:01.882445,32,100000,0.99,2.8359028381542112e-05,20000,0.517535424698935,big,0.05,32,PRUNED
290,290,299.80687739999996,2023-05-18 14:41:12.413394,2023-05-18 14:41:19.895542,0 days 00:00:07.482148,32,100000,0.9999,8.845974577545378e-05,1000,0.857842760525195,medium,0.001,16,COMPLETE
291,291,26.2051264,2023-05-18 14:41:16.388313,2023-05-18 14:41:18.339178,0 days 00:00:01.950865,2048,100000,0.995,3.6056712192317356e-05,1000,0.40944360305213323,big,0.05,32,PRUNED
292,292,17.8391228,2023-05-18 14:41:18.343179,2023-05-18 14:41:20.444190,0 days 00:00:02.101011,32,100000,0.9999,2.112730343601217e-05,20000,0.46039532875922506,medium,0.001,32,PRUNED
293,293,47.877864800000005,2023-05-18 14:41:19.896772,2023-05-18 14:41:23.344211,0 days 00:00:03.447439,1024,1000000,0.9,9.976285318284898e-05,1000,0.19690298251702587,big,0.02,32,PRUNED
294,294,18.613727400000002,2023-05-18 14:41:20.447503,2023-05-18 14:41:23.501410,0 days 00:00:03.053907,64,100000,0.99,1.0351926579065017e-05,20000,0.6188654618633715,big,0.05,4,PRUNED
295,295,167.8277784,2023-05-18 14:41:21.919480,2023-05-18 14:41:27.523871,0 days 00:00:05.604391,32,10000,0.9,0.0031080165770694715,1000,-0.23907733841149864,big,0.005,32,COMPLETE
296,296,40.3773872,2023-05-18 14:41:22.035413,2023-05-18 14:41:25.616396,0 days 00:00:03.580983,32,100000,0.9,0.0005134368118817146,20000,0.28767174904295606,big,0.08,64,PRUNED
297,297,23.3805846,2023-05-18 14:41:23.346662,2023-05-18 14:43:27.066881,0 days 00:02:03.720219,512,100000,0.95,4.244191028899332e-05,0,-1.2041049899163183,big,0.02,64,PRUNED
298,298,15.6211074,2023-05-18 14:41:23.502433,2023-05-18 14:41:25.660018,0 days 00:00:02.157585,32,100000,0.95,0.00015804817115184008,1000,0.6459175124854717,medium,0.001,16,PRUNED
299,299,37.09398,2023-05-18 14:41:25.622291,2023-05-18 14:41:29.389184,0 days 00:00:03.766893,1024,100000,0.98,0.0005675164108088168,1000,0.1841821716177783,big,0.05,512,PRUNED
300,300,13.511597599999998,2023-05-18 14:41:25.671682,2023-05-18 14:41:27.773925,0 days 00:00:02.102243,128,10000,0.999,0.000849460943738104,1000,-0.8949201578804338,medium,0.005,16,PRUNED
301,301,106.22242539999999,2023-05-18 14:41:27.532866,2023-05-18 14:41:32.655827,0 days 00:00:05.122961,2048,100000,0.99,0.0004052418586723239,1000,0.6527132412989216,big,0.08,32,PRUNED
302,302,268.7538402,2023-05-18 14:41:27.780414,2023-05-18 14:41:35.484642,0 days 00:00:07.704228,32,100000,0.95,0.0013571259205837492,20000,0.5130114958527344,big,0.01,64,COMPLETE
303,303,14.2790782,2023-05-18 14:41:29.391258,2023-05-18 14:41:30.883153,0 days 00:00:01.491895,32,100000,0.9999,4.6796094650191754e-05,1000,0.9144642215041601,medium,0.001,16,PRUNED
304,304,93.8041788,2023-05-18 14:41:30.889362,2023-05-18 14:41:34.364364,0 days 00:00:03.475002,32,100000,0.995,1.1883917696051121e-05,1000,0.960128274408091,medium,0.001,32,PRUNED
305,305,43.3039158,2023-05-18 14:41:32.657520,2023-05-18 14:41:35.247247,0 days 00:00:02.589727,32,10000,0.9,0.003053054598627883,1000,-0.9789412206187054,big,0.005,32,PRUNED
306,306,27.6204686,2023-05-18 14:41:34.367195,2023-05-18 14:41:36.784298,0 days 00:00:02.417103,128,10000,0.999,0.02328787038822039,20000,-2.179593003275954,big,0.005,16,PRUNED
307,307,13.126039,2023-05-18 14:41:35.248712,2023-05-18 14:41:37.286289,0 days 00:00:02.037577,32,100000,0.9999,0.0005855164036229866,1000,-0.009153246816063887,small,0.001,16,PRUNED
308,308,70.416603,2023-05-18 14:41:35.487101,2023-05-18 14:41:38.459347,0 days 00:00:02.972246,1024,100000,0.95,0.0016388693720892121,20000,0.5400063330577428,big,0.01,64,PRUNED
309,309,30.406275799999996,2023-05-18 14:41:36.786854,2023-05-18 14:41:39.249007,0 days 00:00:02.462153,1024,1000000,0.98,0.00023671960366064793,1000,0.6165815554726546,big,0.05,32,PRUNED
310,310,20.2342162,2023-05-18 14:41:37.292524,2023-05-18 14:41:39.456044,0 days 00:00:02.163520,128,10000,0.999,0.0010818932336901937,1000,-0.4086874910911449,big,0.01,16,PRUNED
311,311,27.948017000000004,2023-05-18 14:41:38.461735,2023-05-18 14:41:41.261478,0 days 00:00:02.799743,32,100000,0.95,0.04126520309232985,20000,-0.3655940706783536,big,0.01,64,PRUNED
312,312,178.0190534,2023-05-18 14:41:39.254692,2023-05-18 14:41:49.561195,0 days 00:00:10.306503,32,100000,0.999,0.0002624119756750226,20000,-0.7202317488819326,big,0.01,64,COMPLETE
313,313,22.770011399999998,2023-05-18 14:41:39.458314,2023-05-18 14:41:42.358263,0 days 00:00:02.899949,1024,100000,0.995,0.0007302870676073558,1000,0.6492003270977027,big,0.05,1,PRUNED
314,314,28.771180800000003,2023-05-18 14:41:41.272953,2023-05-18 14:41:43.824422,0 days 00:00:02.551469,32,100000,0.995,0.005988120381235865,20000,0.598936714927408,big,0.01,64,PRUNED
315,315,148.48136519999997,2023-05-18 14:41:42.359912,2023-05-18 14:41:50.319800,0 days 00:00:07.959888,32,10000,0.95,0.0008886188749834444,20000,0.6086217651171674,big,0.01,64,PRUNED
316,316,39.7574868,2023-05-18 14:41:43.826460,2023-05-18 14:41:47.236169,0 days 00:00:03.409709,32,10000,0.9,0.004209554215831048,1000,0.8369099617084328,big,0.08,32,PRUNED
317,317,88.68882479999999,2023-05-18 14:41:47.239131,2023-05-18 14:41:52.526692,0 days 00:00:05.287561,32,10000,0.98,0.010565355508251715,1000,0.7307374671382654,big,0.005,32,PRUNED
318,318,103.2944064,2023-05-18 14:41:49.083395,2023-05-18 14:41:54.006308,0 days 00:00:04.922913,32,10000,0.95,0.000442141681432042,20000,0.22355370242913908,big,0.01,64,PRUNED
319,319,21.3737416,2023-05-18 14:41:49.568166,2023-05-18 14:41:51.726081,0 days 00:00:02.157915,2048,100000,0.999,0.0002846378647100658,20000,0.25178392518695625,big,0.01,64,PRUNED
320,320,263.5433398,2023-05-18 14:41:50.321082,2023-05-18 14:42:00.372135,0 days 00:00:10.051053,32,100000,0.999,0.00029473343613678336,20000,-0.0794702051511178,big,0.01,64,COMPLETE
321,321,18.3014544,2023-05-18 14:41:51.729024,2023-05-18 14:41:53.778597,0 days 00:00:02.049573,32,100000,0.999,0.001457936200435782,20000,-1.6772502246956604,small,0.01,64,PRUNED
322,322,31.151519200000003,2023-05-18 14:41:52.528226,2023-05-18 14:41:55.623712,0 days 00:00:03.095486,1024,1000000,0.98,0.00012277331246940415,1000,0.21874423372697843,big,0.01,8,PRUNED
323,323,15.665427399999999,2023-05-18 14:41:53.780141,2023-05-18 14:41:56.501222,0 days 00:00:02.721081,128,10000,0.98,0.19088782885740624,1000,-3.4154622043924703,medium,0.005,16,PRUNED
324,324,103.31895279999999,2023-05-18 14:41:54.010610,2023-05-18 14:41:57.847674,0 days 00:00:03.837064,1024,100000,0.995,0.0003492191943177902,1000,-0.30339387657267775,big,0.001,32,PRUNED
325,325,270.19961559999996,2023-05-18 14:41:55.625404,2023-05-18 14:42:07.790962,0 days 00:00:12.165558,32,100000,0.999,0.00012308683724991215,20000,-1.534466063718876,big,0.01,64,COMPLETE
326,326,24.4576282,2023-05-18 14:41:56.505058,2023-05-18 14:41:59.082651,0 days 00:00:02.577593,32,10000,0.9,0.0012728974583857743,1000,-0.3263998464512504,medium,0.02,32,PRUNED
327,327,28.6199026,2023-05-18 14:41:57.851342,2023-05-18 14:42:00.706145,0 days 00:00:02.854803,32,100000,0.999,5.7094517899960214e-05,20000,-1.495036017186168,big,0.01,64,PRUNED
328,328,50.3007062,2023-05-18 14:41:59.084056,2023-05-18 14:42:03.651835,0 days 00:00:04.567779,32,100000,0.999,0.0007118962328723765,20000,-1.7759401573811942,big,0.01,64,PRUNED
329,329,306.86471459999996,2023-05-18 14:42:00.390475,2023-05-18 14:42:10.164963,0 days 00:00:09.774488,32,100000,0.999,0.0005534003633586131,20000,-0.8104962904564962,big,0.01,64,COMPLETE
330,330,206.1448698,2023-05-18 14:42:00.712945,2023-05-18 14:42:10.582172,0 days 00:00:09.869227,32,100000,0.999,0.0017196514004924734,20000,0.0408447307264921,big,0.01,64,COMPLETE
331,331,47.1420174,2023-05-18 14:42:03.655125,2023-05-18 14:42:06.538630,0 days 00:00:02.883505,32,100000,0.95,9.629637610607246e-05,20000,0.8157866065707745,big,0.01,64,PRUNED
332,332,23.6185362,2023-05-18 14:42:06.541845,2023-05-18 14:42:08.737333,0 days 00:00:02.195488,32,100000,0.999,0.0004048299998275548,20000,0.3676714599175941,big,0.01,64,PRUNED
333,333,125.63853739999999,2023-05-18 14:42:07.793479,2023-05-18 14:42:13.796086,0 days 00:00:06.002607,1024,100000,0.98,0.0001806109899851893,10000,-0.46123950600774044,big,0.001,32,PRUNED
334,334,19.206406800000003,2023-05-18 14:42:08.738795,2023-05-18 14:42:12.325958,0 days 00:00:03.587163,1024,1000000,0.9999,2.632609605039509e-05,1000,-0.15475599179948474,big,0.05,64,PRUNED
335,335,17.558819,2023-05-18 14:42:10.166658,2023-05-18 14:42:13.058459,0 days 00:00:02.891801,1024,100000,0.98,0.0007988628787551188,1000,-0.30357693841285033,big,0.001,128,PRUNED
336,336,8.3919046,2023-05-18 14:42:10.583633,2023-05-18 14:42:12.061048,0 days 00:00:01.477415,32,100000,0.98,0.0005771192854134733,20000,-1.065585750369253,medium,0.01,64,PRUNED
337,337,130.5942962,2023-05-18 14:42:12.062782,2023-05-18 14:42:18.854813,0 days 00:00:06.792031,32,100000,0.95,0.004110516781007908,10000,0.7735311932717381,big,0.02,64,PRUNED
338,338,21.826984600000003,2023-05-18 14:42:12.328837,2023-05-18 14:42:14.785760,0 days 00:00:02.456923,32,100000,0.999,0.002282397199003,20000,0.527173745377357,medium,0.01,64,PRUNED
339,339,21.6061872,2023-05-18 14:42:13.059850,2023-05-18 14:42:16.236799,0 days 00:00:03.176949,32,100000,0.999,0.0009648364230381796,20000,-0.43160662613427714,big,0.005,64,PRUNED
340,340,48.9188082,2023-05-18 14:42:13.798750,2023-05-18 14:42:18.372357,0 days 00:00:04.573607,32,100000,0.999,1.3698474988884969e-05,20000,-0.14848300870995385,big,0.01,8,PRUNED
341,341,27.6982976,2023-05-18 14:42:14.787178,2023-05-18 14:42:17.821150,0 days 00:00:03.033972,32,100000,0.999,4.413634226251544e-05,20000,-0.4966001274505279,big,0.02,64,PRUNED
342,342,16.901753999999997,2023-05-18 14:42:16.239031,2023-05-18 14:42:18.471720,0 days 00:00:02.232689,32,100000,0.9,1.178284336845801e-05,1000,0.24132450871473998,medium,0.02,16,PRUNED
343,343,28.255619000000003,2023-05-18 14:42:17.824759,2023-05-18 14:42:20.785182,0 days 00:00:02.960423,32,1000000,0.999,0.012494520061270642,20000,-0.10594989711148121,big,0.01,64,PRUNED
344,344,33.823499999999996,2023-05-18 14:42:18.379768,2023-05-18 14:42:22.231606,0 days 00:00:03.851838,32,100000,0.999,0.002734318216195642,1000,-0.8513812740667712,big,0.01,64,PRUNED
345,345,13.0561174,2023-05-18 14:42:18.492980,2023-05-18 14:42:22.465004,0 days 00:00:03.972024,32,100000,0.98,8.203176282730164e-05,20000,0.23955589171206237,big,0.05,64,PRUNED
346,346,22.7223942,2023-05-18 14:42:18.864053,2023-05-18 14:42:21.391284,0 days 00:00:02.527231,16,100000,0.999,0.00041405678709843964,20000,-0.554437355162271,big,0.01,4,PRUNED
347,347,113.19781,2023-05-18 14:42:20.789605,2023-05-18 14:42:25.694965,0 days 00:00:04.905360,64,100000,0.999,0.01022161186558564,20000,-0.7530671452577424,big,0.01,64,PRUNED
348,348,118.677565,2023-05-18 14:42:21.393594,2023-05-18 14:43:42.326549,0 days 00:01:20.932955,32,100000,0.9,9.545594659583836e-05,0,0.4424715310674385,big,0.001,32,PRUNED
349,349,14.7094968,2023-05-18 14:42:22.232946,2023-05-18 14:42:24.146741,0 days 00:00:01.913795,128,100000,0.98,0.00021266242801573504,20000,-1.2829157761529557,big,0.01,64,PRUNED
350,350,14.1935672,2023-05-18 14:42:22.467854,2023-05-18 14:42:25.784260,0 days 00:00:03.316406,32,100000,0.95,0.004272772131645332,20000,0.4367947165648942,big,0.05,64,PRUNED
351,351,90.42483460000001,2023-05-18 14:42:24.149871,2023-05-18 14:43:38.900036,0 days 00:01:14.750165,32,100000,0.95,0.0002143504222250562,0,0.21542104153925404,big,0.001,64,PRUNED
352,352,-0.21282420000000002,2023-05-18 14:42:25.700542,2023-05-18 14:43:40.453058,0 days 00:01:14.752516,32,100000,0.99,0.00012208795365548815,0,-0.27447290759858667,big,0.01,64,PRUNED
353,353,54.170574,2023-05-18 14:42:25.786095,2023-05-18 14:42:29.095244,0 days 00:00:03.309149,32,100000,0.95,0.0006320292793725932,1000,0.29385042279435425,big,0.001,32,PRUNED
354,354,30.1144362,2023-05-18 14:42:26.625450,2023-05-18 14:42:29.601763,0 days 00:00:02.976313,32,100000,0.999,0.00264808627113683,20000,-0.9123268662995464,big,0.01,4,PRUNED
355,355,42.3241214,2023-05-18 14:42:29.096522,2023-05-18 14:44:16.168412,0 days 00:01:47.071890,256,100000,0.95,6.924468271710058e-05,0,-0.2887484334268315,big,0.02,1,PRUNED
356,356,14.546491400000003,2023-05-18 14:42:29.603510,2023-05-18 14:42:31.641471,0 days 00:00:02.037961,64,100000,0.999,1.9349124117472214e-05,10000,0.7027659387849844,big,0.05,4,PRUNED
357,357,47.1493542,2023-05-18 14:42:31.646115,2023-05-18 14:42:34.252958,0 days 00:00:02.606843,1024,100000,0.98,0.00013940037940905086,1000,-0.4723153809102656,big,0.005,64,PRUNED
358,358,12.3520242,2023-05-18 14:42:34.254483,2023-05-18 14:42:36.019322,0 days 00:00:01.764839,32,100000,0.999,0.00038664642087906693,20000,0.30271514472088246,big,0.001,16,PRUNED
