,number,value,datetime_start,datetime_complete,duration,params_batch_size,params_buffer_size,params_gamma,params_learning_rate,params_learning_starts,params_log_std_init,params_net_arch,params_tau,params_train_freq,state
478,478,18.5662664,2023-05-18 15:01:07.409135,2023-05-18 15:01:10.757601,0 days 00:00:03.348466,1024,1000000,0.9,0.00029333555087752365,1000,-0.9191023789272128,big,0.05,32,PRUNED
479,479,17.170943599999998,2023-05-18 15:01:08.645038,2023-05-18 15:01:10.553283,0 days 00:00:01.908245,512,100000,0.9999,3.331649956527434e-05,20000,0.484765460876824,medium,0.001,16,PRUNED
480,480,12.6745908,2023-05-18 15:01:09.852613,2023-05-18 15:01:12.431764,0 days 00:00:02.579151,32,100000,0.9999,0.0007210210008127322,10000,-0.5208320606800398,medium,0.001,16,PRUNED
481,481,74.7353318,2023-05-18 15:01:10.554902,2023-05-18 15:02:17.338925,0 days 00:01:06.784023,16,100000,0.98,0.0003939021586136886,0,0.7537191188825842,big,0.05,1,PRUNED
482,482,-0.17179680000000003,2023-05-18 15:01:10.760608,2023-05-18 15:04:46.412348,0 days 00:03:35.651740,2048,100000,0.98,0.0013446773426332875,0,0.7881326085784266,big,0.05,4,PRUNED
483,483,12.0269998,2023-05-18 15:01:12.432944,2023-05-18 15:01:14.391367,0 days 00:00:01.958423,16,100000,0.99,0.00012495700475619807,1000,-0.10519472922877654,big,0.05,32,PRUNED
484,484,246.644593,2023-05-18 15:01:14.394626,2023-05-18 15:01:20.316997,0 days 00:00:05.922371,1024,100000,0.999,0.00020341996339733122,1000,0.46125775623427384,big,0.02,32,COMPLETE
485,485,103.35177619999999,2023-05-18 15:01:20.329917,2023-05-18 15:04:13.351701,0 days 00:02:53.021784,1024,100000,0.95,0.0003147621745682994,0,-0.07224984063105921,big,0.01,1,PRUNED
486,486,20.7384098,2023-05-18 15:01:25.030678,2023-05-18 15:01:27.279620,0 days 00:00:02.248942,1024,100000,0.999,0.0004087839996444491,1000,0.6090530721388394,big,0.02,512,PRUNED
487,487,20.4887272,2023-05-18 15:01:27.285333,2023-05-18 15:01:29.808552,0 days 00:00:02.523219,1024,100000,0.999,0.0005961103759161076,1000,0.4096196620840002,big,0.02,32,PRUNED
488,488,478.3405368,2023-05-18 15:01:29.811602,2023-05-18 15:04:50.472189,0 days 00:03:20.660587,2048,100000,0.9999,0.017773422600881154,0,0.5028477759441269,big,0.05,32,COMPLETE
489,489,15.6904166,2023-05-18 15:01:42.116354,2023-05-18 15:04:23.868156,0 days 00:02:41.751802,1024,100000,0.999,0.00039755977519221643,0,0.2873559107203073,big,0.05,1,PRUNED
490,490,10.472196199999999,2023-05-18 15:01:45.958137,2023-05-18 15:01:47.805534,0 days 00:00:01.847397,1024,100000,0.99,0.0005649379716528982,1000,-0.18528094065781814,big,0.005,32,PRUNED
491,491,38.891224199999996,2023-05-18 15:01:47.812064,2023-05-18 15:03:49.193533,0 days 00:02:01.381469,512,100000,0.99,0.00012021661078023723,0,-0.38831793086240984,big,0.05,32,PRUNED
492,492,209.0473266,2023-05-18 15:01:54.235948,2023-05-18 15:02:01.029801,0 days 00:00:06.793853,512,100000,0.999,2.189515634060349e-05,1000,0.5993546177776103,big,0.02,32,COMPLETE
493,493,23.8135124,2023-05-18 15:02:01.031826,2023-05-18 15:02:02.901662,0 days 00:00:01.869836,32,100000,0.9999,0.00021677069887875153,1000,-0.10289506466294374,medium,0.001,512,PRUNED
494,494,22.4259976,2023-05-18 15:02:02.906169,2023-05-18 15:02:04.769646,0 days 00:00:01.863477,512,100000,0.999,3.60322776139511e-05,1000,0.5283737642631762,big,0.02,32,PRUNED
495,495,28.2427642,2023-05-18 15:02:04.773331,2023-05-18 15:04:34.711796,0 days 00:02:29.938465,1024,100000,0.95,1.6021242946084018e-05,0,0.387792708859228,big,0.05,1,PRUNED
496,496,58.314059799999995,2023-05-18 15:02:17.342663,2023-05-18 15:04:31.502994,0 days 00:02:14.160331,1024,100000,0.98,0.0021409573286388273,0,0.6675973666269586,big,0.05,64,PRUNED
497,497,23.418892200000002,2023-05-18 15:02:22.451388,2023-05-18 15:02:24.687155,0 days 00:00:02.235767,32,100000,0.9999,0.0006999393049941952,1000,0.21096133117705385,big,0.01,64,PRUNED
498,498,84.07389459999999,2023-05-18 15:02:24.688354,2023-05-18 15:03:54.361203,0 days 00:01:29.672849,256,1000000,0.95,0.001984048457096144,0,0.7167568062754857,big,0.05,32,PRUNED
499,499,77.0327252,2023-05-18 15:03:49.196382,2023-05-18 15:04:19.883259,0 days 00:00:30.686877,256,1000000,0.99,0.0025334845570778018,0,0.5311256897512511,small,0.05,32,PRUNED
